region_code,category_id,video_id,title,published_at,view_count,like_count,comment_count,channel_title
AU,15,cZaEdEdbrpw,English or Spanish? My neck is now forever messed up loudly_crying_faceface_with_tears_of_joy,2024-11-30,980130,101553,280,Haley Kalil
AU,15,UAPyZ2rKndQ,Is roofing a scam?,2024-11-20,4190411,244759,1274,TestBiz
AU,15,X_0Ch4BepIw,Which smol kitty is your favourite?,2024-11-20,7904608,555358,7816,Raznar
AU,15,9LBMBrm877M,This woman entered the wrong toilet face_screaming_in_fear,2024-11-27,1358124,121327,3996,Mr. Mack
AU,15,fb1bE8iY0fA,You must answer correctly or else..fearful_face,2024-12-02,690406,25570,12,LebensGeist
AU,15,hpg16mdUe2U,I can’t stop watching it face_with_tears_of_joyface_with_tears_of_joy,2024-11-18,7940232,588569,3830,Top Funny Moments
AU,15,0Wum329Ytcs,shortvideo cat mycatchannel funny petschannel yourcat funnycats catchannel,2024-11-25,13214792,511696,2099,Jeff Canal
AU,15,Y0zn7n31yFY,"Once again, the dog is scared.",2024-11-21,4664430,102922,432,Funnycat5
AU,15,bDxvKPgpvao,Deep-Sea Fishing,2024-11-20,11400364,63809,519,Aloys-Mythical
AU,15,WimxPaaVjOg,Anaconda vs Crocodile - The Ultimate Showdown,2024-11-21,2547968,62635,582,Wild Animalia
AU,15,8Kp7ADxncyM,The Weirdest Sea Creature in Vietnam! exploding_head,2024-11-19,8783182,0,322,27 Crew
AU,15,o6pEJYRxq6Q,The farmer chases away the pigeons,2024-11-04,501312,6852,76,World Discovery
AU,15,gL5kH0zrFRU,The Cobra was like ayooo come back i kinda like that snake,2024-11-17,7115848,264858,6913,joshjamesofficial
AU,15,I-ZmJUUdxZg,Animals that grow huge as adults,2024-11-23,4533987,438472,856,Facts Quest
AU,15,Y6I3CdwfEUg,When Karen shames other customers…,2024-12-03,243589,37122,253,fromscratchbaker
AU,15,H8m_NbxrNVw,"A kind-heart man rescued a bear that had been electrocuted, then",2024-11-26,7577338,162405,1694,Wild Animal 247
AU,15,4qzaRu0WOI8,The end face_with_tears_of_joyface_with_tears_of_joy episode 618,2024-11-30,641626,52802,166,Pets And Laughs
AU,15,-_yqAPrln6M,20 Year Old Rescue Cow Finds Her Soulmate | The Dodo,2024-12-02,691594,87887,1034,The Dodo
AU,15,kG2Cz5Ryv3U,dogbroken_heart,2024-11-09,3848710,0,0,S R Karnataka
AU,15,MMQxfnzHer8,Never Buy Colorful Chicks!! hatching_chickface_screaming_in_fear,2024-11-26,2755969,448989,17347,Petcademy
AU,15,b-4qLHGEgvI,dog puppy love funnyanimals baby shortsvideo shorts,2024-11-12,17878064,1177067,3054,animal diary
AU,15,rD4tPyB6fIM,The law of the world is that living things do not want each other,2024-11-23,13176377,155362,1348,Fish Hunting Kurdish
AU,15,JzY3kdDQX8k,Someone was getting too close to me on BLACK FRIDAY,2024-11-29,1012889,31979,45,invisaWear
AU,15,Y0s-oHoiBFk,This is crazy,2024-12-02,123837,13871,185,Kat Clark
AU,15,unc3ZPQ_30w,Firefighters save girl surrounded by a dog,2024-11-22,6268312,235429,392,FunnyClips
AU,15,SqarRt0U7YQ,The dog was reborn and met his masterface_screaming_in_fearrelieved_face,2024-11-24,3392286,219279,443,9-1-1 house
AU,15,Y5CmY4PZdHc,These Bird Sound skullbirdfire,2024-11-29,12843698,602280,3395,𝕭𝖊𝖆𝖘𝖙𝖑𝖞 𝕾𝖔𝖓𝖌𝖘
AU,15,SSyZ-BVInSI,Buying Every Fish From the Live Fish Vending Machine... *deadly fish*,2024-11-30,859318,27186,2120,The Fish Guys
AU,15,TEgGHNdjV3c,Hippo vs leopard,2024-12-02,4902658,156546,1375,Rendi goodboy
AU,15,QvEVsa_5M0w,ELE FEZ A ESCOLHA CERTA ?,2024-11-26,16826686,435718,589,Ruy Cardozo
AU,15,Q9npQk3CkyI,He man_pouting Found A Puppy dog But What Happened Next right_arrow Will Shock You face_screaming_in_fear,2024-11-30,1014086,79354,327,MrSpindle
AU,15,1SPA-uMw19Y,Obvious hint you dropped but he just didn't get it..,2024-11-23,1411878,137780,568,Unsaid Tales
AU,15,psz8u6Cx0JA,HUNTING WITH A 50 CAL BMG || SHOOTING PIGS & FERAL CATS,2024-11-29,250883,10822,464,RJM Hunting Australia
AU,15,8Xmr2H1Y3U8,most out of pocket things i’ve experienced in school,2024-12-01,1112146,116163,705,Tina Colada
AU,15,1fa3_mr6oCQ,ASMR | Immersive SPA with Manyu & Bai | Relaxation & Sleep Aid,2024-11-30,9602484,285770,1388,是曼玉不是鳗鱼 Littlemanyu
AU,15,HYYaDtb2YXA,Mythical Pet,2024-12-03,395411,48186,5608,Gengar
AU,15,v6CI3WgZc7k,Best brothers forever white_heart,2024-11-17,4201664,65931,2045,Tipsiz Family
AU,15,YTw8yLwqYtk,funny funnycats cat funnypets pets funnyanimals,2024-10-31,9071369,478914,2297,petfunnytime666
AU,15,8OQTiD6YGNg,I wouldn’t want this job! flushed_face exploding_head,2024-12-01,491141,59961,573,Nick's World
AU,15,FZX_Sg03dIk,Golden Eagle vs Himalayan Ibex: A Predator’s Ruthless Hunt,2024-11-17,7906406,213247,2740,fact bite
AU,15,hc-sHHkh9ns,EVERY DOG NEEDS THIS! face_holding_back_tearsdogbus,2024-11-27,826643,120795,675,A1 Animal
AU,15,KlURmINnMlU,1 Big Fish vs 1000 Small Fish flushed_face,2024-11-20,2668170,0,127,Moggerly
AU,15,Xds1ve9730I,SURPRISED BY MY RESCUE PUPPY WHEN I GOT HOME,2024-11-22,2671445,195128,1016,Cactus
AU,15,_TOJqfBhbRY,We listen and we don't judge!,2024-11-28,1587421,147464,398,Courtney & Alex
AU,15,aNyIF1e9KsI,Repost from Thanksgiving 2022!,2024-11-29,1040632,69622,103,Adria and Oatmeal
AU,15,LL0JijlicRk,THIS CATFISH BELLY EXPLODED from EATING a FISH TWICE HIS SIZEexploding_head,2024-11-24,2218501,105980,1041,Predatory Fins
AU,15,RzvasPnaNQg,I don't know what was said. The leopard was also confused. This operation made me dumbfounded.,2024-11-30,6576700,75464,558,Funny Animal World
AU,15,Xa_GyPh_Jo8,This cat wants all the smoke. dashing_away,2024-11-22,2574276,98526,2477,Valuetainment Comedy
AU,15,E739_o9XvyE,Goose raised among swans,2024-11-29,951777,37347,216,Animal salvation
AU,15,qknC94Mcayw,Choose a turkey for today,2024-11-28,911972,64934,9074,YoJacq
AU,15,K_ZTGFQ4vDE,His Pet Buffalo Cared For Him So Much! red_heart,2024-11-24,2714190,94347,1427,Infinitix
AU,15,G6s-ctXNKpQ,This moose needed help!,2024-11-28,741146,48878,779,StoryToldd
AU,15,nFLIona8ogk,“This Cat Keeps Getting Fooled by a Horsecat_with_tears_of_joycat_with_tears_of_joycat_with_tears_of_joy,2024-11-20,8686286,111939,519,pet_funnytimes1
AU,15,e0b2bDzQBRA,He really sad “ are u ok” before saving the Dog.,2024-11-26,1657837,109392,2602,Twist levrai
AU,15,Fo9KmQ0GP14,The tiger intrudes into the dog’s family,2024-11-20,4366856,103440,418,Wildpaws777
AU,15,qBByq4UXRmU,Ma’am. We’ve got bigger fish to fry.,2024-11-26,958841,87272,425,Pleasant Peasant Media
AU,15,CSQVXC9JP4U,"Subscribe to our channel, Подпишитесь на наш канал, हमारे चैनल को सब्सक्राइब करें।",2024-11-27,5016588,104547,536,Farrier Life Shorts
AU,15,H7gws94BRN4,Funky Burga Took My Wife And Kids,2024-11-25,707034,52403,480,Lulu & Boba
AU,15,irU9KPK42Ts,Do you want me to get beat up?,2024-11-17,8024577,305075,1225,EchoSpot
AU,15,vm3koLohKPc,Team Elphaba green_heart or Team Glinda pink_heart,2024-11-28,564242,34741,994,The Rybka Twins
AU,15,56FGAo_nWZI,when your frog legs got a mind of their own lol @Jaymarv29 funnyvideos reels shorts,2024-11-20,3760391,187648,4293,MarvelousJames
AU,15,MGjj9tuccTo,She gave me a black eye…,2024-11-22,1006460,72798,845,Ellie the tabbycat_face
AU,15,cOjgHZPoOzw,"Ostensibly a doctor,but actually a rare animal dealer?",2024-12-02,257692,24447,34,Canada Devil
AU,15,U62Yg1SUrJ0,Sneaking My LiTTLE SiSTERS OUT of SCHOOL *GONE WRONG*,2024-11-30,862362,17822,2937,JUSTKASS
AU,15,oEZyTp4ZGac,Tiger Speeds for Buck Hunt,2024-11-27,7649046,39498,34,QAMAR IQBAL
AU,15,lRUknXOIQVA,Omg ..face_screaming_in_fearflushed_faceface_with_open_mouth,2024-11-29,11092321,122545,434,Mousumi’s Gallery
AU,15,g6rucrY3DCo,Caterpillar to butterfly butterfly,2024-11-22,4376413,237207,2860,AlfaProton
AU,15,DfbyQOaD2Dw,This Dog is Living the Best Life face_with_tears_of_joyred_heart,2024-11-26,1270217,57184,356,Brennan Rogers
AU,15,PsVk0Yjd9g4,Turning Leftovers Into Chicken Treats,2024-11-21,4108364,135289,1292,Wild Heart
AU,15,J1yEv8Fco6g,Million Dollar Dog Abandoned pleading_face,2024-11-25,2186473,207878,18153,Richard Richie
AU,15,4qWSlRd284Q,ME MUERO CON ESTAS BAÑERASface_holding_back_tearsface_screaming_in_fear,2024-11-17,7181840,114796,492,Cristobalgsss
AU,15,j_W97I4MFIE,Your Thanksgiving Turkey is a Dinosaur,2024-11-27,984403,91181,1429,Cleo Abram
AU,15,rlV1fyuY35w,He finds a RARE ANIMAL under the SAND! face_screaming_in_fear,2024-11-18,2417561,167230,214,Ameropo
AU,15,ulSiWcHV2yI,English speaking cats,2024-11-21,3436427,214639,1128,Prank
AU,15,EcxJE2vdGiw,Why They Brand Animals With Cold Iron,2024-11-12,13206366,0,2458,Peeple
AU,15,JOMdtNOZ8M8,When your neighbor’s cat thinks your yard is their kingdom...Can we paw-lease talk about boundaries?,2024-11-16,5931502,198862,10053,NeighborProblems
AU,15,dD-YdfGYuqI,Bloat in Animals!cow | What is Tympanism?magnifying_glass_tilted_right,2024-11-28,1357049,33216,50,Wild Short
AU,15,F4Y15u4TPyQ,He was a different color flushed_face,2024-11-28,885600,99201,1541,dogsbylogan
AU,15,SreDsaKpSQk,TWINSweary_face,2024-11-27,835094,39429,553,Carlo and Sarah
AU,15,5wbImDfvlXg,Worst aura loss moments,2024-11-20,14518578,0,209,Astro Edits
AU,15,52biTRYZ8OM,Cuties,2024-11-28,3048864,68617,369,VOCAL CORE 🅥
AU,15,Z1l0GH5RlrI,IL LABRADOR: COME SI SPEGNE QUESTO QUA,2024-11-17,7032807,227166,7247,TvJFlashBianconero
AU,15,VOpsIjMgUZk,Don’t cross Milo,2024-11-22,4226425,183026,335,Jared_and_Milo
AU,15,7cs1g_Ruwlk,Lady Frees Deer After Its Head Gets Stuck in Cat Food Bag,2024-11-24,3198403,53141,290,ViralSnare Rights Management
AU,15,CuwIkc-9iIw,A dying woman says goodbye to her parrot. The bird's response will make you cry.,2024-11-23,1502433,77028,1264,Ghiorso Wallbrown
AU,15,zmHFtpijbGA,Why Do Dobermans Need Their Ears and Tail Docked?,2024-11-21,4522259,121050,1038,Interesting Knowledge
AU,15,Ob4J4MybToM,The dinosaur place is the best!! My dad used to take me here all the time as a kid smiling_face_with_hearts,2024-11-30,480454,7096,31,Brittikitty
AU,15,EAIHx6mf_Us,You Won't Believe What This Wildlife Vet Just Realized—It's Taking the Internet by Storm!,2024-11-07,9747231,118223,334,Paws and Prose
AU,15,kUVAbr1UO4Y,Puppy takes care of the baby paw_printsred_heart,2024-11-20,6449508,399615,2454,Halenur
AU,15,MBxMcI3YCoI,Has this ever happened to you? loudly_crying_faceloudly_crying_face,2024-12-01,373282,27703,1252,JUSTJULESsparkling_heart
AU,15,EXkDH1f_AGc,Sir,,,12237270,584024,10680
AU,15,CoRf7Z7uETg,Até mesmo os chamados Animais Selvagens nos dão Amor Incondicional e Carinho,2024-11-19,21665899,0,4411,Helio Garriga
AU,15,-0dQS_Gmwk4,This Boy Found a mystery Boxface_screaming_in_fearface_screaming_in_fearface_screaming_in_fear,2024-11-22,1008318,28105,52,Etheal Stories
AU,15,YdoDRBm3Gv0,They’re worth the sacrifice,2024-11-22,2944396,187589,412,Agirlandadoodle
AU,15,Qc71nWSt-8Q,Catterpillar technique to protect itself ||ETERNAL HUB ||,2024-11-21,3380133,0,564,ETERNAL HUB
AU,15,MEi7WlKb4Js,Testing a Hamster's Survival Skills,2024-11-23,3298792,83581,3187,Dr. Plants
AU,15,-cZFTJv-cPI,WICKED WEINERS Part 2green_heart,2024-11-30,279233,11780,533,Gunner and Greta
AU,15,8LbxzAEUAcE,Why he does it?thinking_face,2024-11-18,2114382,77542,331,SOUSPASS
AU,15,IgfE7HAXdmo,Oil testnerd_face Who has the clearest skin?smiling_face_with_heart-eyes,2024-11-23,4762298,188538,1498,Diana Belitskay
AU,20,YRzln9ES1bw,How to get INFINITE EMERALDS,2024-12-03,1441831,147370,922,Bent
AU,20,ZmPyLyayp5A,EASTER EGGS in Fortnite Chapter 6!,2024-12-03,607247,38991,239,SypherPK
AU,20,-dJAhKekt_I,Citadelle des Morts Gameplay Trailer | Call of Duty: Black Ops 6 Zombies,2024-12-03,452115,26099,1742,Call of Duty
AU,20,hgYhws0AHcg,Juice WRLD - Empty Out Your Pockets (Official Fortnite Video),2024-11-30,6809520,485807,42572,JuiceWRLDVEVO
AU,20,S-NbCPEgP1A,The fastest CPU in the world,2024-12-02,1229742,49884,3042,Linus Tech Tips
AU,20,T3ZaWDcPiIo,GTA Online: Agents of Sabotage Coming December 10,2024-12-03,597134,29942,4907,Rockstar Games
AU,20,SV7HV5pUGLg,I Busted EVERY Fortnite CHAPTER 6 Myth!,2024-12-02,655605,15797,2616,McCreamy
AU,20,X8aj0N03Bi8,Minecraft's Best Players Simulate a Cold War on Hardcore Minecraft,2024-12-01,1849279,24089,1834,Forge Labs
AU,20,gzv9t4scTWg,Epic made a BIG mistake...,2024-12-02,588744,16934,466,Lachlan
AU,20,lGBAi0rKczk,Fortnite OG: Chapter 1 - Season 1 Cinematic Teaser,2024-12-03,987380,64161,3146,Fortnite
AU,20,Jskq4jLQ7go,The Slickness of Red Dead Redemption 2,2024-12-03,732326,57713,3757,videogamedunkey
AU,20,C5RvoPQZQeM,Suing Minecraft Because They Broke The Law & Pissed Me Off,2024-12-03,353669,59733,5245,Kian Brose
AU,20,cxWWtkTOIGg,Cursed Bluey in Among Us,2024-12-02,815678,31296,2540,SSundee
AU,20,j5-o3M65gKk,CITADELLE DES MORTS GAMEPLAY TRAILER: SWORDS LOOK INSANE!! (Reaction & Breakdown),2024-12-03,176559,7887,868,MrRoflWaffles
AU,20,2jXg6b8Qe_c,Ranking EVERY Fortnite Chapter 6 Item,2024-12-03,243014,11276,771,Reisshub
AU,20,CcPsHG7pyI0,UNO But My Friends Won't Stop Pointing and Laughing at Me,2024-12-01,1298003,66767,1124,SMii7Y
AU,20,wDkC-erpNHg,I Tested Clickbait Fortnite Shorts To See If They Work...,2024-12-03,328175,6454,396,Ali-A
AU,20,Vd4jKRzpF1Q,WHAT WAS THE THOUGHT PROCESS?! | Pico Park 2,2024-12-01,1006604,63481,1637,Markiplier
AU,20,RjhjuOW8bSk,Types of MM2 Players.. 2,2024-12-01,1069604,75829,249,Vindooly
AU,20,bShs_EfluBU,OG Race to Unreal in Fortnite,2024-11-30,860710,18807,1279,PWR
AU,20,0Nvtogunh9U,Shadow The Hedgehog - The Final Ending,2024-12-02,918379,90036,3939,Lythero
AU,20,mE_Wk2ojb0I,The *RANDOM* CHAPTER 6 BOSS Challenge!,2024-12-02,799385,14785,679,TG Plays
AU,20,sCczMOlK1b8,"hi, I'm Marley.",2024-12-03,474192,70154,10253,Marley
AU,20,FanNoQg06w0,"FORTNITE *CHAPTER 6* is HERE! (New Map, Weapons and Mythics)",2024-12-01,1875705,25901,763,Typical Gamer
AU,20,xZ8DQgTvrLg,I'm going to jail,2024-12-03,639055,36248,4130,Flamingo
AU,20,N2JLXUE20q8,SIDEMEN PLAY S&D UNTIL THEY WIN,2024-11-30,1267104,52668,1603,MoreSidemen
AU,20,zkmy4OKA728,I finally played the so-called best Batman Arkham game,2024-12-03,252821,21639,1097,zanny
AU,20,JtOU3I7CLak,Fortnite CHAPTER 6 - EVERYTHING NEW EXPLAINED!,2024-12-01,1067876,30319,1613,Top5Gaming
AU,20,wc9On7mGACk,"*NEW* FORTNITE CHAPTER 6 UPDATE!! NEW MAP, BATTLE PASS & MORE! (Fortnite Chapter 6)",2024-12-01,818885,12009,79,Pack A Puncher
AU,20,IiwLveSqWjA,The BEST Chapter 6 Drop Spot,2024-12-02,210209,13571,120,More Lachlan
AU,20,iAtGwcho-gs,REAL MADRID 2 - 0 GETAFE CF I RESUMEN LALIGA EA SPORTS,2024-12-01,3686078,70499,1913,LALIGA EA SPORTS
AU,20,6y6vro1orQA,The Slot That Owes Me The Most,2024-12-03,262287,13739,1293,Vegas Matt
AU,20,YqAStezYEtk,MASSIVE Progress! | Hermitcraft 10 | Ep.37,2024-12-03,194748,24021,1397,SmallishBeans
AU,20,Poa-o9aKsmk,"Buckshot Roulette - Bodycam Sucks, Wildcat Joins The Shootout!",2024-12-03,442725,24365,709,VanossGaming
AU,20,qas3HW6Qn7s,Starter Base | Ep. 2 | Impossible Minecraft,2024-12-01,502312,39991,2018,LDShadowLady
AU,20,mWkajLU7fxQ,Cloak & Dagger: Inseparable Bond | Character Reveal | Marvel Rivals,2024-12-04,277861,17750,1520,Marvel Rivals
AU,20,8v0UC3uiRqY,Leagues Damage Situation is Crazy,2024-12-03,228746,7811,299,Settled
AU,20,sumdJisz408,UNBELIEVABLE WORLD CHESS CHAMPIONSHIP GAME 7!!!!!!,2024-12-03,516088,24051,1248,GothamChess
AU,20,9XbbapMzh1g,Wild Life: Episode 7 - SUPERPOWERS,2024-11-30,1110230,77272,4290,Grian
AU,20,mAMigOfBSfk,I Entered a Tournament with a One-Hit-KO Team,2024-11-30,1279494,45837,2176,WolfeyVGC
AU,20,F0N4yHkrTXY,Path of Exile Leak Drama,2024-12-02,729650,15326,2107,Asmongold TV
AU,20,b2oK_Fhktd8,LOS RATONES UPPER BRACKET FINAL VS TEAM FRANCE FT ADAM & TRAYTON - NNO TOURNAMENT,2024-12-03,246294,7146,353,Caedrel
AU,20,gJF6tEKwxUg,OnlyFangs Hardcore Deaths Are Getting Worse..,2024-12-03,78890,1303,167,Xaryu
AU,20,s0CkEMVg_Ac,Testing Roblox's Most HORRIFYING Myths..,2024-12-01,939612,28481,1965,CaylusBlox
AU,20,o9czW1REfhg,Baus FULL COACHING SESSION with Bwipo | Los Ratones Highlights,2024-12-03,182391,5863,346,Los Ratones Community
AU,20,hlIU9WXwPWk,PWE CS2 SHANGHAI MAJOR 2024 - OPENING STAGE - Day 4,2024-12-03,463892,3976,22,PGL
AU,20,KkmonzpHVRg,30th Anniversary | Thank You,2024-12-02,1494408,123876,11713,PlayStation
AU,20,Naz2AnngcqY,This Game is Lethal Company as a Memory,2024-11-30,1294490,63631,988,SMii7Yplus
AU,20,0vKS0FOYNok,The Garden Awakens | Official Trailer,2024-12-03,542366,42801,2427,Minecraft
AU,20,O5R5vJtFTxk,SPRUNKI COUPLES in PHASE 2?! (Kiss Mod),2024-12-02,1104555,42110,1612,Tyler & Snowi
AU,20,XNy3AZRbeN0,THE RANGE TANK BUILD IS COMPLETE,2024-12-02,238145,5890,148,Solo Mission
AU,20,3VSKuTcw2_U,"Official Rust, but i built a Solo's paradise in a brutal wasteland...",2024-11-30,724061,25766,1984,Willjum
AU,20,Igkln_jztqo,NickEh30 reacts to Fortnite Chapter 6 Live Event!,2024-12-01,1216758,23072,2190,Nick Eh 30
AU,20,3osoYB2KDiY,JJ and Mikey in SQUID GAME Roblox CHALLENGE in Minecraft / Maizen Minecraft,2024-12-02,403721,6498,111,Mayzee - Minecraft
AU,20,8pACksO2StY,Minecraft Word Wordle 2,2024-11-28,3671060,272268,462,GroveManDan
AU,20,eRvJUmBx9uQ,MYSTERY WHEEL OF FOOD IN AMONG US w/ The Norris Nuts,2024-12-02,91475,2165,295,Norris Nuts Gaming
AU,20,eWGpBqc36sQ,Home Invasion Christmas Horror,2024-12-01,302265,16488,725,Daz Games
AU,20,eW9pmyPX78I,GUESS THE ELO!!! GUKESH VS DING,2024-12-03,320440,10797,1084,GMHikaru
AU,20,4lB3TM5FrsY,We're prepared for UP TO 1 MILLION Players on Early Access - Jonathan Rogers,2024-12-02,216086,7067,1396,Zizaran
AU,20,ud0jXAK5Uls,Sunday Trailer — Soloist | Honkai: Star Rail,2024-12-03,571562,70787,2974,Honkai: Star Rail
AU,20,zAzsrKxt4YQ,Why Kids Are Quitting Roblox,2024-12-02,630419,22562,8824,KreekCraft
AU,20,ObNyxwkc7p0,DOJO EXPANSION TRAILER + SHOWCASE | Blox Fruits,2024-12-01,3694892,217050,48722,Gamer Robot
AU,20,6Lpx_lcrJ40,10 FRIENDS on a MOANA ISLAND!,2024-12-02,429403,13266,1652,Aphmau
AU,20,XI5SFS4IIKE,Fortnite Juice WRLD FULL EVENT (Chapter 6 Live Event),2024-11-30,585037,9333,1213,ShuffleGamer
AU,20,zeSVP9cKalA,A CUTE GAME ABOUT MOVING HOUSES,,,266174,19684,866
AU,20,rAKu1j82ZO4,TYLER1: LVL40+ ELITE QUEST AS LVL 30,2024-12-03,84671,2311,277,loltyler1
AU,20,2S34-dgrn-8,The Sea Emperor… (SUBNAUTICA),2024-12-02,377230,16634,1444,CaseOh
AU,20,hBEttjMPE_k,Fortnite Juice Wrld Finale Concert *FULL LIVE EVENT*,2024-11-30,624046,18597,1754,FortniteBRFeed
AU,20,G4W9NCVjfA4,Using Only BAD Pokémon in a Nuzlocke Race,2024-12-01,603876,30393,913,Alpharad
AU,20,7vVYpONbdO8,Upgrading My Little Brothers Fortnite Account For 24 Hours!,2024-11-30,1080237,9080,940,Renju
AU,20,og7JoNDxz3I,(V42) Ranking EVERY Brawler from WORST to BEST! | Pro Tier List 2024,2024-12-02,414747,16564,1711,KairosTime Gaming
AU,20,baRkqtuBKeU,They brought me back.,2024-11-30,867352,65172,1650,Mumbo Jumbo
AU,20,KSGU5mruBGs,"NOOOOOO, THIS HAS GOTTA STOOOOOOOPP.",2024-12-02,540946,36943,1525,Phoenix SC
AU,20,7y3Au1KiUd8,World's *FUNNIEST* Minecraft Memes,2024-11-30,725493,14403,1082,PrestonPlayz
AU,20,NoLRs9cxH90,Was Pandoras Vault Really Made in Survival?,2024-12-01,613608,33890,1268,Kenadian The Cat
AU,20,6ARjrl74nc4,I Built a Theme Park of Perpetual Agony in Planet Coaster 2,2024-11-29,2110912,104203,3756,Let's Game It Out
AU,20,kp5I8ig7wKw,I Got All 6 MYTHICS in ONE Game!,2024-12-01,397417,4727,268,Ali-A²
AU,20,FcOZCP6Oy4E,ENTIRE Chapter 6 - Season 1 Battle Pass (Fortnite: Hunters),2024-12-01,649681,17097,2258,Shiina
AU,20,zPCCC5IHvYQ,NEW CHAPTER 6 XP GLITCH!!!,2024-12-01,377631,13897,1595,HYPEX
AU,20,vUWAKvne47w,Can you beat Ready Or Not WITHOUT killing anyone?,2024-11-30,948752,52573,1492,martincitopantsLIVE
AU,20,2G-nA_m6kBk,MY FIRST PENTAKILL IN MY PRO CAREER?!,2024-12-01,635675,25868,769,Thebausffs
AU,20,59zJIuX3pQc,MONGRAAL PLAYS FORTNITE CHAPTER 6!,2024-12-01,263913,8570,287,Mongraal
AU,20,bVti5_eP2NU,trying to fit as many secrets as we can in a MANSION | part 2,2024-12-01,321814,34233,1089,CarynandConnieGaming
AU,20,mzNpKrnk1Bk,I Caught MEGALODON in Fisch!,2024-12-01,403630,5710,997,Bax
AU,20,Zr8K585TIcs,Bloodborne is a Top 10 Game of All Time,2024-12-01,294194,8038,1188,penguinz0
AU,20,Q-vXjBN2Bmc,Testing Scary Minecraft Myths That Are Blocks…,2024-11-30,1048767,19994,3904,EYstreem
AU,20,9uRPS1lR7yA,"Group B, Day 2 | 2024 LoL KeSPA Cup",2024-12-01,1516749,4929,154,한국e스포츠협회
AU,20,TTY9bvYLAVc,FORTNITE CHAPTER 6 IS INSANE,2024-12-01,448974,14842,754,MrSavage
AU,20,BGpKmJLSmlA,One Thousand Uncles,2024-11-30,450811,36816,2562,Uncle Dane
AU,20,BdljTnme--8,𝗷𝘂𝘀𝘁 𝗼𝗻𝗲 𝗺𝗼𝗿𝗲 𝗹𝗮𝗻𝗲.,2024-11-30,490146,32593,1800,Valefisk
AU,20,kqVOIb-5Bsg,"*NEW* FORTNITE CHAPTER 6 UPDATE RIGHT NOW!! NEW MAP, BATTLE PASS & MORE! (Chapter 6 LIVE)",2024-12-01,474196,13411,103,Grxnt
AU,20,O0mgxRYCmdI,Ninja Reacts to Fortnite Juice WRLD Event,2024-11-30,418227,20352,1015,Ninja
AU,20,PfDk0WxpqhM,I Transformed a CAVE into an OCEAN in Minecraft Hardcore,2024-11-29,1272277,33361,3363,aCookieGod
AU,20,W7Jc_9GcDkA,When you Accidentally Trap an Entire Rust Clan,2024-11-29,490160,24689,830,Stimpee
AU,20,o7rrTQjo_1c,I'm Projecting?! - Wild Life Ep. 7,2024-11-30,266415,19989,879,GeminiTay
AU,20,MVMFD105BDw,A Toy-riffic Clashmas Season Is Here!,2024-12-01,1588668,39071,1555,Clash of Clans
AU,20,kLn9IfdLv9M,F2 Sprint Race Highlights | 2024 Qatar Grand Prix,2024-11-30,258668,6698,240,FORMULA 1
AU,20,FhPrNY7Slrk,MY WOLF FAMILY IN MINECRAFT!,2024-11-30,569118,23102,2653,ItsFunneh
AU,20,tLAzsWvSw4E,1 Goal = 1 Mystery Card Pack,2024-11-30,382544,5927,452,Pazjor
AU,20,QPDV9C29dfw,Gentlemen's Ultimate Werewolf,2024-11-29,681892,51287,2929,Smosh Games
AU,20,6CmKRIBQC2g,i caught him recycling...,2024-11-29,460250,12674,1741,spoonkid2
AU,20,iKt-gLQxkIw,ImDOntai Reacts To The JuiceWRLD Fornite Concert,2024-11-30,451365,25559,965,ImStillDontai
AU,20,oXUc2wwsm34,How To COMPLETE EVERYTHING in ANCIENT ISLES Update GUIDE in Roblox Fisch..,2024-11-30,427233,7535,689,RFG
AU,20,yQuvHDjiazY,Cheating Challenge in Sims 4,2024-11-29,354951,24413,1663,Slushy Noobz
AU,20,i1Adrhb3ojs,Escaping Villager Prison Is IMPOSSIBLE...,2024-11-29,597504,14956,1957,SeaWattgaming
AU,20,IIsLaRTgSE0,The FUNNIEST R6 Clips...,2024-11-29,493971,14156,776,Jynxzi
AU,20,XMFIWcrNru4,A MINECRAFT MOVIE Trailer 2 (NEW 2025),2024-11-19,3092721,7577,523,JoBlo Animated Videos
AU,20,VrK8__d9nog,I Hosted A Streamer Only Chapter 2 Hide & Seek!,2024-11-30,501446,12884,822,CouRage Gaming
AU,20,dyf7z4tbB70,Hunters vs WOLVERINE in Minecraft!,2024-11-30,448049,7058,666,Cash
AU,20,wAgkNEIaz58,Fortnite Remix The Finale Event Full [NO COMMENTARY] - Chapter 2 Juice WRLD Concert Live Event,2024-11-30,124526,2981,362,Comrad3s
AU,20,1oOnmczmcPc,Answering Your UNHINGED Questions,2024-11-29,596186,51511,1857,Schlatt & Co.
AU,20,8CVeY-9zmUM,How hard is it to beat Factorio SPACE AGE?,2024-11-28,629969,27683,2061,DoshDoshington
AU,20,N3XJqDGmanE,1000 Players Simulate Civilization Across Dimensions,2024-11-27,870560,33822,3387,MARCUSK
AU,20,N0cjSCFmq-c,"Fortnite Juice WRLD Concert (Chapter 2 Remix The Finale) [Full Event, No Commentary]",2024-11-30,278812,8493,1122,EveryDay FN
AU,22,KQw7sxrrpRs,The Elf Has Arrived & Picking Our Christmas Tree With The Family | Vlogmas Day 1,2024-12-02,559475,31537,680,Zoe Sugg
AU,22,P6IDB1UIIVM,"weekly vlog love_letter tiktok awards, massive giveaway, new cookware, pilates",2024-12-01,23657,609,28,Jaz Hand
AU,22,FA9eOb_VS7w,Mysterious Blog。,2024-11-28,364858,38197,18,Mr. z films
AU,22,B6BrAzbmsWI,Choosing the tree for Christmas & Decorating with the family,2024-12-02,114379,5860,327,ThatcherJoeVlogs
AU,22,GsnRnqPyb8Q,NO BUDGET Christmas Gift Swap with SAFFRON BARKER!!,2024-12-03,71355,2482,56,Anastasia Kingsnorth
AU,22,2neqabM9oVM,Vlogmas Starts Tomorrow & My Last Video of 2024!,2024-12-01,216381,10899,334,Alfie Deyes Vlogs
AU,22,e6HXMFQPhwg,"GETTING INTO THE CHRISTMAS SPIRIT *nails, shopping, decorating, & cozy night in* | Vlogmas Day 1",2024-12-02,262776,17765,1303,Nicole Laeno
AU,22,NibXcbyvd5M,CHRISTMAS WITH THE MILLEN-GORDONS 2024 | THE REVEAL  | Lydia Elise Millen,2024-12-02,90883,3406,408,Lydia Elise Millen
AU,22,wxEIRzA7r1Q,Decorating for Christmas + Living Alone Diaries!! Vlogmas Day 2,2024-12-03,58559,3537,153,AlishaMarieVlogs
AU,22,DRRCRnvosGI,OUR ENGAGEMENT SHOOT & Vlogmas Drama Recap...,2024-12-03,109846,5588,428,RemLife
AU,22,t1q8D4akvh0,decorating our home for Christmas | VLOGMAS DAY 1,2024-12-02,109284,9979,524,"XO, MaCenna Vlogs"
AU,22,KOq0MurDSBY,the first day of vlogmas — cozy day at home & decorating for christmas,2024-12-02,90487,8269,686,Steph Bohrer
AU,22,W1TCnjvAH-Y,"OOPS, I RUINED THE OLIVES & FINISHING THE HOUSE EXTERIOR",2024-12-01,91487,10737,754,Nicki Positano
AU,22,cPejWwQaBR0,giving my staircase the ULTIMATE 70s makeover,2024-12-03,75371,7008,613,TheSorryGirls
AU,22,H2ZiiyEwW-g,BLACK FRIDAY HAUL 2024!!,2024-11-30,164193,6444,196,MissRemiAshten
AU,22,bt41XwZDTkA,spend a weekend with me (in my lover girl era hehe),2024-11-27,39822,1934,115,Georgia Richards
AU,22,F7OIHn89lbs,Living Alone Again.... VLOGMAS,2024-12-03,141486,9352,1168,morgans vlogs
AU,22,w0Kwc2jUDIs,a literal 58 minute vlog of Halloween month... (watch it or i'll cry),2024-11-24,635406,29028,1883,Tana Mongeau
AU,22,d_EWpo4JuaA,WE MOVED AGAIN… vlogmas day 1,2024-12-02,145865,8054,654,Samantha Jo
AU,22,pX2BqeufZWc,FIRST WEEK IN MY NEW NYC APARTMENT *alone..*,2024-11-24,957817,49202,1647,erica ha
AU,22,CJnENczNdqI,I can’t believe it… Work has Started on the Brand New Headquarters!! house_with_gardensheaf_of_rice,2024-12-02,162898,8290,549,Life of Tom
AU,22,Q2hCVnXnERs,"6AM PRODUCTIVE DAY IN MY LIFE *cleaning my fridge, working out, everything shower routine*",2024-12-02,55854,3877,190,SusieJTodd
AU,22,DWrTGL7j7Aw,DECORATE WITH ME for CHRISTMAS *Cozy Victorian Village Holiday Decor*,2024-12-02,141890,13196,522,"XO, MaCenna"
AU,22,PkVDUQ_Sxdo,I Got Sent To The Wrong Country!,2024-11-28,413488,9723,794,MashtagBrady
AU,22,9InADmsXVBw,Getting Lost in Our Woods! evergreen_tree,2024-11-29,103561,12619,474,The Chateau Diaries
AU,22,HwC9gjdYo6k,FiRST TiME PREGNANT MORNiNG ROUTiNE! *Baby can come ANY DAY*,2024-11-29,518035,12752,2602,JustParkers
