region_code,category_id,video_id,title,published_at,view_count,like_count,comment_count,channel_title
US,1,3ftYtuz1FSM,This is good,2024-11-29,13148224,838931,558,Dylang Solis
US,1,xUMZKR2D1Xo,The store owner senses something is wrong and rushes the customer away,2024-11-25,30062649,2272977,6407,Kaylee YTB
US,1,CEEsMSX07gA,foryou fypage family,2024-11-29,7544370,970667,2232,Golden Horizon Cinema
US,1,7o7LWemEyEY,That will be the story of you Django | Django Unchained,2024-12-01,3872604,237027,1166,Tyler Movies
US,1,JxuFed8pDXs,Will saved him.,2024-12-01,5448787,246633,424,Caleb
US,1,aXr2fBc3ax0,That's a cognitive puzzle. - Grey's anatomy (Season 19 Episode 03),2024-11-30,7466681,0,953,MovieClip
US,1,YjuChJ4ngoY,Smashed Lamborghini!,2024-11-26,8588479,727104,824,Cheyne Ken
US,1,2TIkwW0o_G0,Saving money on shopping or shopping to save money,2024-12-01,6340899,474235,326,Georgia Clips
US,1,PUZ9WcyTh8w,Spider-Man won everyone’s trust with his actions smiling_face_with_heartssmiling_face_with_heartsspider,2024-11-30,7540416,542651,855,Satrafili Nikolaos
US,1,xjCbdW7zSXA,Weekend Update Pays Tribute to Norm MacDonald red_heartrolling_on_the_floor_laughing COLIN JOST & MICHAEL CHE,2024-11-30,3445046,150453,1148,MICHAEL & COLIN
US,1,RdbTTye1WZk,He was penetrated by rebar but felt lucky!,2024-11-28,3218767,456551,2011,Kaylee Nostalgia
US,1,CrarxzeBLtc,El Cucuy face_with_tears_of_joy RENE VACA,2024-11-24,12217518,603538,2621,Rene Vaca
US,1,HCah1fLfKrU,When your best friend suddenly leaves you,2024-11-25,29402543,1959525,7234,Cuba
US,1,j05sCtUoIWM,Megatron asked the military for his men back.,2024-11-29,7328805,513462,1680,Abbie Movies
US,1,Bi2F-A_edkQ,“Hang on one sec.”,2024-11-29,6551462,656476,762,Paul Jordin
US,1,-qhB5eb6sWg,Stupid Homer.,2024-11-28,5640025,538398,1021,Bart Wow
US,1,HnLtfOOwHEo,Real KUNG FÚ on the WATER,2024-11-27,7658526,212722,4393,Celin Vasquez Ofical
US,1,2P1TYpah2ME,Hilarious New Bucket Pull.. face_with_tears_of_joyface_with_tears_of_joy | Kill Tony ft. Ben Khoshaba,2024-11-28,2970402,211464,1943,Slice Comedy
US,1,I6q8XEM1ZXM,MAMA knows best,2024-11-27,11184835,425336,3292,Music forever & short clips
US,1,CbMMZnlAUEI,Kai Cenat Asks Kyrie Irving About His Age! face_with_tears_of_joyloudly_crying_face,2024-11-29,3407024,232568,1270,Succesful Celebrity
US,1,yTvvG-UQK-Q,The bad guy angered John Wick:”Viggo is gonna understand “,2024-11-29,7680137,681822,1990,John Movie
US,1,4IeSGdONwEM,"Edward asks the other families to help his daughter, but they don’t believe her",2024-11-30,5355201,414626,918,Futukoobration Clips
US,1,0nnsb5XCBZE,The Original John Wick Revenge Begins loudly_crying_face I,2024-11-23,5688522,187735,1467,Super Movie Editor
US,1,9vtP1gpD2kw,His Food Truck Is Getting Towed fearful_faceface_with_peeking_eye,2024-11-25,10437741,1092895,2413,Eureka Reels
US,1,Q8hUVe3msZI,Unexpected Laughs: Kid Tests Firefighters' Teamwork!,2024-11-23,16603217,996260,2960,Mr. z films
US,1,xWaNXoEGGxA,Unreasonable arrests,2024-11-27,4765355,443633,1896,King Movie
US,1,9zvbfLUHCNw,Shane Gillis Knows His Historyrolling_on_the_floor_laughingface_with_tears_of_joy,2024-12-01,2268864,119427,817,HMSvids
US,1,IoVB5Hn2m_k,HELLUVA BOSS - MASTERMIND // S2: Episode 11,2024-11-29,9427453,770359,68346,Vivziepop
US,1,Ytz-_1IFnH8,The soldier sacrificed himself for Joe,2024-11-25,10148012,402912,1889,Pirate Tales
US,1,c053sYv3dFI,Quinn Pulls A Mom | Dexter S6.E9 |,2024-11-30,2344985,140350,315,Sumatica
US,1,r0k5EKoGTfA,Lopez goes undercover as a homeless person |,2024-12-02,2363295,195739,405,The Rookie (Fan Page)
US,1,kscKeJzAyy0,Who can enter the bathroom?,2024-11-30,3405840,184828,118,Mad Mike
US,1,tAE-tbYLyKY,DEFEND THE HOUSE! Send the robber flying! face_with_tears_of_joy,2024-11-30,6435499,358156,831,MrTalalaa
US,1,osbBsxNVbcw,"Donald Trump Was Almost On Kill Tony!!!face_with_tears_of_joyface_with_tears_of_joyface_with_tears_of_joy| Garbage, ft. Tony Hinchcliffe",2024-12-01,1671418,115657,816,LifeofLogos
US,1,0DObfv7c6SQ,Dorothy meets Scarecrow on The Yellow Brick Road- Wizard Of Oz Comedy Recap,2024-11-25,3176937,237224,837,It's Only Entertainment
US,1,jC0QGkLLFPw,Has she really gotten prettier?,2024-11-28,8761693,789147,831,Rachel Clips
US,1,9kzut3tshlU,"Kai Cenat Got Mad After Magician Breaks $20,000 Glass Table loudly_crying_face",2024-11-27,6595975,449871,1784,DaPlug
US,1,FAr2rk0k_Q4,Kai Cenat Kevin Hart & Druski FULL STREAM,2024-11-28,3829765,69834,5834,Kai Cenat Live
US,1,J6zQPU_C5IM,Wildlife,2024-11-27,5738012,144084,3039,Julia TK
US,1,unD_IhfPakg,So in battle it’s all about cleaning toilets?,2024-12-01,1540075,167764,175,Mcnichols Don
US,1,6hakXwLbsDs,Homer suddenly became very kindbeaming_face_with_smiling_eyes,2024-11-24,6061026,557993,285,Tickle and Scratch
US,1,AsLGojcRO8s,The guy infected the girl with penicillin...fearful_face,2024-11-27,2528935,226303,233,Medical House
US,1,h_qtxKcLP-w,Walter counterattacks Hank who discovers everything.,2024-11-29,4004967,120416,976,Robin Clips
US,1,0vXFV5PkjNI,Popular from WICKED movie VS broadway,2024-12-01,2914299,172314,513,SiPROW
US,1,1xL6ZeC9XKw,movies shorts dwaynejohnson,2024-11-27,4370742,471356,138,everet5672
US,1,k2Y0HQDyiJc,Beware of the unusual element,2024-11-29,2054356,209929,763,bpa9062
US,1,_d67KYcmKV0,Please don’t underestimate women.,2024-11-24,31194871,1191147,7750,Abigail Reviews
US,1,8Xc2kHXPdrE,kids running the wrong way,2024-12-01,2503716,213752,1892,baddie norris
US,1,vDUIo57CWtg,movie shorts shot caller,2024-11-26,3712398,237857,1585,bbzfun21
US,1,L-JaT-bHYxc,Salute To The Brave Firefighter Uncle!,2024-11-13,80058899,1189161,0,Blueberry Lutein
US,1,plJdWb3MvsQ,Reminds me of my mama.,2024-11-29,3499864,208561,579,Garcia movies
US,1,S9vqkQ5VOrw,50 Cent Starstruck by Meryl Streep & surprised by Kobe Bryant,2024-11-29,2500288,143390,828,SlimShots
US,1,7bok4XlR9do,He persuaded all the carssmirking_face,2024-11-30,2789609,197117,567,9-1-1 house
US,1,oezAifq0pjs,music movie shorts,2024-11-29,3556401,416368,640,Peng Shuai
US,1,Cu2hfZwC9rA,"If I got here in 1949,and it’s 2023,what does that make me?face_with_tears_of_joyA reptile movie:",2024-11-25,7512917,540123,2496,Nancy Clips
US,1,_HPDlDrYvdc,Life is a miracle of countless times of never giving up.,2024-11-27,7600680,448583,591,changingmovie
US,1,I8mMEoOP6pQ,Why Henry Cavill Is The PERFECT Actor!,2024-11-29,2375513,184004,2323,GCR Designs
US,1,h1h1ICESs7o,Kai Cenat And The Boys Do Attitude Now Walk Off Challenge face_with_tears_of_joy,2024-11-23,11122379,385242,2692,Worthy Streamers
US,1,OE9DEAdKw7o,I didn’t stay you weren’t successful,2024-11-25,6015257,722605,1031,Sere432
US,1,9s2djcazNsg,He Proved His Critics Wrong In The BEST Way,2024-11-28,5872910,610756,4978,Andy Jiang
US,1,rHH_-obC1wM,All it took was one punch face_with_tears_of_joyface_with_tears_of_joy,2024-11-27,10423386,378614,3585,deagzzzshorts
US,1,vlPOW7ECCl4,It’s Not Affecting Anything | Matt Rife,2024-11-29,1253528,45576,365,Comedy Highlights
US,1,4iXnhICMvRo,Frog Eye vs Whale Eye,2024-11-27,7983035,338803,1550,Pulp Mania
US,1,s-3igbewbos,John and Rip's love of ranching,2024-11-29,1869205,60234,421,Minella FI
US,1,M0qp-RxsYOE,HE GOT SO TIRED OF MY MOM ASKING QUESTIONS,2024-11-24,6605129,300231,3715,Andreas Polychronis
US,1,QV5G83T66Ik,This mon bravely defended her daughter who was bullied by others,2024-11-25,7825746,1045945,1873,FunnyClips
US,1,J4ieV83mAN8,Haley Wins The Challenge skull || Modern Family Funny Moments ||,2024-11-26,3442611,0,357,Mister Assertive
US,1,t5u9gs5-3CQ,Comedian SCHOOLS Heckling Audience Member,2024-11-24,5813050,292240,4755,Red Shorts Politics
US,1,G1iXQtYn24c,Rick Saves Jerry...,2024-11-11,5133498,507926,2354,Berf Ai
US,1,_Q0bjGfwOkc,He ain’t lying tho face_with_tears_of_joy,2024-11-23,4958629,333524,5223,Jaykidproductions
US,1,ooXOMEv9uQU,Something’s wrong with the left phalange,2024-11-23,17943320,1172413,4933,Paul Movies House
US,1,7bkwaboVteA,Josh Brolin On SCARFACE Influencing THANOS in Avengers: Endgame,2024-11-25,4665181,199067,1077,Cantina Talk
US,1,RNYJQly9chs,Cybermen made of wood,2024-12-02,1032945,119816,387,Brought Kooky
US,1,vJquGTwiKSw,Why Killing Baby Thanos idea Wouldn’t Work?fearful_face,2024-11-29,2482636,163019,447,Farry
US,1,JSNDoZPjTfU,Bernadette is actually a bully.rolling_on_the_floor_laughing,2024-11-27,3707204,160210,545,Elvia movie
US,1,LmpAcBkKrtU,Chris’s pursuit allowed Tony to escape the attack.,2024-11-30,1276343,67133,204,Mark Animations
US,1,5uuI2tzcvLo,What’s the point of a gold chain?,2024-11-29,3527373,297553,189,Martha
US,1,8KRM-w5fjK8,Stan realise he could TIME TRAVEL,2024-11-30,2106603,225061,129,White Daddy House
US,1,rOPnxks0jBY,They thought it was an enemyface_screaming_in_fearsaluting_face,2024-11-25,4861334,222499,1530,Soldier House
US,1,q4n1u-SgXqA,Bart fails his testpensive_face |Shiloh Dynasty|,2024-11-24,5249429,298935,4604,Young_CJ
US,1,KtuZbj3mMXE,Hit by a car …And a truck,2024-11-29,2890249,226456,220,Danso Corriga
US,1,b6FTKe-u8XI,Can I get scout badge?,2024-11-20,21545667,1598240,2976,Richard Restatement
US,1,CyhREWKScEA,When u pay people to water_pistol your wife’s work boyfriend,2024-11-29,1442041,122116,213,Suburbbaby
US,1,jT-L2RZSCbA,Does Brian play Minecraft? face_screaming_in_fearfire,2024-11-26,6081195,718558,554,Peter's Family
US,1,Oiyk2dnEHNk,Military Fall In Exercises Part 3,2024-11-26,3587008,571428,347,Kevin Langue
US,1,gEj39NUPLs4,"A couple had a car accident; the pregnant wife vanished, leaving her husband extremely worried.",2024-11-21,21917364,1538723,1244,cineaste
US,1,3umX4GJ35s0,She is a talented chess player chess_pawn,2024-11-24,5306299,324424,746,KarlonTV
US,1,V8fpfTmAXa4,Why was she so mad skullrolling_on_the_floor_laughing,2024-11-28,2782200,111448,536,Funniest YT Clips
US,1,mOBLfM6AJpU,"Baby birds ‘gape,’ opening their mouths wide to signal hunger when they haven’t learned to eat yet",2024-11-28,4121837,534096,2727,Natural Habitat Shorts
US,1,trQFyUEXKKU,There was originally an eagier way,2024-11-23,6769730,414073,184,Zachary Clips
US,1,iUxuSm80j68,"So,was it the chicken or the egg that came first ?",2024-11-27,1934597,184126,362,Grealish
US,1,fNgKpACF7ko,Brian became a hero flexed_biceps,2024-11-23,5290105,472212,478,DudesHouse_k
US,1,ylvbT8VzHAE,Teacher found the girl was gifted.,2024-11-23,12689783,564962,1369,Mango MOVIE
US,1,S2ajiigGV9A,Taco Tuesday,2024-11-28,4354265,200974,232,MOVIE TART
US,1,VrAiTTYxTP0,So guess what I did to what sandwich? || How I Met Your Mother,2024-11-25,6938431,387633,573,Jackson Clips
US,1,5Ehs5uPLpNg,Can an overly dominant mother raise a child with low self-esteem?,2024-11-24,4673690,475131,809,Queen's Theater
US,1,YpYMWNHrdtU,I met a master of comedy. I never expected it. I laugh every time I watch it.,2024-11-28,15892246,170713,471,Funny Life In The Countryside
US,1,MAtIgOiFFC8,The sequel to Beetlejuice,2024-11-25,6025118,372616,832,Jeo movie
US,1,SDx0epswrJs,He made a deal with the thugs smirking_facewater_pistol,2024-11-25,4360172,341255,1914,FlexxFlixx
US,1,g8gQf7bsur4,20 GIRLS VS 3 COMEDIANS: LIL RT & LIL WOODY & SHAMAR,2024-12-02,663465,33010,438,Lah Mike
US,1,7vB-nPNuZl4,I love how gentle House is with the kids.,2024-12-01,1409948,87890,530,Martin Films
US,1,n1whIRPqbEc,Save me like I'm your friend.,2024-11-27,2305936,226863,191,ReelRenaissance
US,1,qHecSpzXs3s,Fiona gave her best time to her younger siblings.,2024-11-28,1392209,75232,668,Brianna Movies
US,1,6xBE89WTCwU,This cowboy was helplessly wronged.,2024-11-26,1259650,44013,144,Jordan Recapped
US,1,Fwv8wlEK03Y,Sheldon’s ability to win the Nobel prize has finally taken a turn for the worse!,2024-11-28,2888133,143139,604,GeorgeClips
US,1,Qsqqa2YA4Bs,Sheepshead toothfish,2024-12-03,1184519,90361,258,SQFT Fish
US,1,_kyMBlZbNB4,The way the police chief deals with gangsters is very special,2024-11-26,1486695,135104,904,Simon TV
US,1,U-lz_rywjP0,Sylvester Stallone,2024-11-27,1495533,61040,133,jacob801a2
US,1,ScNFjQ_Fl5o,Can't believe he'gone,2024-11-27,2986421,169399,313,CineFactory
US,1,q9_Xw87vAfE,They shouldn’t have disturbed him angry_face | Person of Interest |,2024-11-21,8529704,352759,1716,My Movie
US,1,4O1O3aVW1-U,I mean.. it makes sense now face_screaming_in_fearface_screaming_in_fearface_screaming_in_fear,2024-11-26,3948676,315520,3449,Ivan Mars - Movie Detective
US,1,-Cv6N9UQnMU,MOVIE BLOOPERS That Are Better Than The Script!,2024-11-29,1613797,123574,135,Scene Craft
US,1,WjNAnqtZJeU,Chris Outsmarts Fish Seller | The Sopranos S2E6,2024-11-30,1437085,117771,264,iBlameJaice
US,1,VIrUrbzA7iQ,Orlando Brown Can't Handle All That loudly_crying_faceperson_facepalming_medium-dark_skin_tone,2024-11-30,791697,47091,1532,SkinBone
US,1,i5BYpahnCR4,Your Thoughts? face_with_tears_of_joy,2024-11-26,1748473,68748,1398,Mentor House
US,1,AGkfh0qWQN0,Bill Skarsgård recreates his Pennywise Smile,2024-11-28,2301931,62117,643,Outstanding Screenplays
US,1,XnPojuZauAU,Even Penny Can't BELIEVE What  Sheldon Said!.. | The Big Bang Theory,2024-11-26,3679418,250684,729,SitcomMembers
US,1,RUNCsT3iosY,Think You Can Ace the DAYS OF THE WEEK Quiz?,2024-11-20,11033652,159497,0,Buggle Time- Wholesome & Fun Toddler and Kid Songs
US,1,2EHlTfv_PP0,Zeno is to strong,2024-12-01,1501015,67622,428,AFAMBOBIE
US,1,lK8DXT-zASY,How does she play volleyball with her headrolling_on_the_floor_laughing?,2024-11-24,6909015,346888,595,Phil8457
US,1,hLefE8EB04Y,He just wants a headset,2024-12-02,1071736,92277,164,Caleb Movies
US,1,y-csxGBwuF8,Mandy planning for Georgie’s 18th birthday but…,2024-11-30,1917755,102451,266,Daddy Cooper
US,1,P9hb9WwDd0E,Using a child as what?,2024-11-22,9257551,699917,859,Cinephile
US,1,zui219LS6rY,POV: Anytime the Boys are Outnumbered,2024-12-01,1379712,80092,561,SaucyTV
US,1,sleN6xlDFsM,ToRung short film: folded_handslet's love each otherwrapped_gift,2024-12-01,10702904,811970,644,ToRung
US,1,wHtz99duyWU,And that’s on Fluffy math,2024-11-26,3843229,219229,427,Gabriel Iglesias
US,1,MnyKb-Sgbtc,memes I found on the internet (part 21),2024-11-30,1491242,65884,560,subscribe if you aren’t gay
US,1,7mqqorPp5Iw,The Lincoln lawyer Season 3 on Netflix.,2024-11-20,5233826,305379,437,Kingsley King
US,1,6AE17m1K4I8,When You Can’t Communicate With Gen Alpha @THEROCKSQUAD,2024-11-22,9745894,140180,817,yoangelolo
US,1,--o10NJXcBo,"Carl didn't learn how to distinguish weight, while his father taught him by example.",2024-11-28,640217,45480,139,Shows Clip
US,1,VsvPy-rzLHQ,Redshell could NOT stop laughing rolling_on_the_floor_laughing,2024-11-24,4570534,282685,2103,Redshell
US,1,VUC1QozCCUI,Women are forced to do fake paperwork by the powers that be.,2024-11-29,1701215,145696,443,Canada Devil
US,1,PXECaYmJVQE,Bro turned a crumb into a fortune skull_and_crossbones,2024-11-20,55839645,3003253,8403,Winners_Mentality
US,1,w5GHcVxWd0c,Marge gave Bart a bad pill...fearful_face,2024-11-25,2892136,273663,486,Simpsons Home
US,1,HRvZUhCirFw,Arrow can flash though walls too?,2024-11-22,5981759,594721,428,Green Rose
US,1,QUnph8dQSBY,Good sport | Avengers: Endgame,2024-12-01,1184477,76864,652,Tesseract Movie
US,1,HNdIqeKnm0I,Crazy Grandfather Holds Chris Hostage,2024-12-01,1342515,136455,125,Gmoydi
US,1,AUQ-xCSs5gM,“why does the Tri-Beam make square holes?”,2024-11-27,2197932,172562,1700,Carthu's Dojo
US,1,ikqA6HQM8Qo,This guy handled Sheldon like a pro,2024-11-24,3735446,304035,532,FJ_Clipper
US,1,WspN9sCAhoI,Suitcase trend (GONE WRONG),2024-11-26,4304172,235272,3197,Brianna Mizura
US,1,Ub1JxQlPTHM,The SpongeBob Movie: Sponge Out Of Water,2024-12-01,0,10555,0,YouTube Movies
US,1,pcSQ25rq3jg,Doctors don’t talk but are good at diagnosis.,2024-12-01,938693,86946,217,Devin Restatement
US,1,AN20GwpOMlE,Amenadiel's magic is out of control and stops time S05 E08,2024-11-27,1376397,166374,275,小笼包电影
US,1,tpH9bWkVcuY,The Worst Job Imaginable whale,2024-12-01,978843,88682,669,Very Important People
US,1,pMOtat6Lpq0,The patient is not sick but gets sick because he is too afraid of getting sick,2024-11-28,2261812,106321,315,Matthew Amy
US,1,l7SbEjyD5MI,Sheldon is so funny when he's drunk,2024-11-19,4056244,227100,842,Squirrel Stories
US,1,ZecadxesLK8,I really didn't do it loudly_crying_face,2024-11-20,34147917,527787,0,Little Hero Super Z - Official Channel
US,1,kbyZiYpImnU,When I ask my wife to order a pizza pizzaface_with_tears_of_joysparkles,2024-11-28,2088848,128590,1057,Saucy Justin
US,1,ECbu_II-O-M,Marge found the Secret Room shushing_facethinking_face,2024-11-28,2250835,158182,161,Simpsons wow
US,1,_cFfkg8Mt3Q,Tacoma FD tradition-Newcomer Pranks.,2024-11-27,2338355,228001,150,Isabella EZ
US,1,au4pqZUQ3Pg,marvel ironman You said one out of fourteen million We win,2024-11-26,5630668,443877,1893,Crying Raccoon
US,1,CBAJya4wbMc,Lies just accumulate like credit cards.,2024-11-24,2153426,241877,304,CatCut
US,1,G2APcOr7Gn8,The great lice eradication campaign.,2024-11-22,6233445,300857,378,Joyce ken
US,1,lW8plp37l0s,Some People Don’t Want To Be Saved (Original Animation Meme),2024-11-25,12525511,237397,254,AnimatedAnna
US,1,kSZ76IqhpV4,Arthur obtains the trident.,2024-11-24,6768519,464502,1113,Thomas
US,1,j2GDEpkCCfw,Keanu Reeves Created the John Wick Reload,2024-12-01,658257,47732,210,Unchained Clips
US,1,wyGX8GqPEp4,Terrifying Trap.,2024-11-27,1449568,131291,384,Garuda DVD
US,1,5HsKFTLxfoI,Maya realized what Lucas was about to face,2024-11-26,3505511,256415,648,Stephanie
US,1,T8WIIRBPu5Y,D&D Animated: Ghost Clown Fanfiction?! unicorn,2024-11-29,1677369,237661,755,Legends of Avantris
US,1,MNK3yZuhOjw,What Happens if Luca Enters a River?,2024-11-10,13306962,210388,0,Cartoon Science
US,1,ZxFVvYI1gI4,Judge Toys With Guilty Woman face_with_tears_of_joy,2024-11-27,1988316,99891,593,courtshorts
US,1,V_wnzbSWn_k,I’m Sleeping Outside Tonightrolling_on_the_floor_laughingrolling_on_the_floor_laughing,2024-11-30,1101849,42806,155,Anxiety couple
US,1,QTkFf9Xhw_U,I Broke The Filterskull,2024-12-02,1553443,127319,881,kirkiimad
US,1,upzmlLrgmiE,Sass’d do anything for Jessica face_with_tears_of_joy,2024-11-27,1630506,111096,112,Whoopee Clips
US,1,evgtdmTBg0E,LA CASA ES MIA,2024-11-30,12761720,589243,1772,Alfredo Larin
US,1,GzMaiWz-PLM,My TOXIC Trait,2024-11-28,2985999,298340,4626,Haminations
US,1,ZG8vjuk49Io,The Big Bang Theory | Leonard: What's He On Trial For?,2024-12-01,1125015,55558,144,Sitcom Hub
US,1,Upeadb0cgFM,Donny was innocently imprisoned for him?,2024-11-27,1529433,171562,156,Kevin LY
US,1,e5x0dIqWrac,If Yu-Gi-Oh's Shadow Realm was Realistic,2024-11-30,1251458,102879,623,CircleToonsHD
US,1,AvM7rdJQ9NI,Audio by ​⁠@_videojames_,2024-11-27,2499887,341638,4936,Punkey Doodles
US,1,z5qgL3zwxG4,You have more in common with us than with them.,2024-11-24,6403946,325431,696,Melisandre
US,1,E-AGnz36j20,Vijay thalapati coldest moment skull_and_crossbonesbackhand_index_pointing_left,2024-11-16,45728933,1641814,2437,Youtube mind
US,1,Ln9xhVtr6os,A man kidnapped a family...exploding_headcrying_face,2024-11-27,1477030,135800,169,JustMovie
US,1,Tlg8ono43no,Cuando fue a prisión y salvó a su padre,2024-11-25,30474394,2606758,8634,TonyFalz MX
US,1,-K9D244SYMU,Movie review,2024-11-24,3158167,400076,1236,SATISFACTION SHORT
US,1,JUSqAqHlt5I,When it comes to customers who want to eat for nothing,2024-11-22,9169942,511900,413,Amber9384
US,1,_ZLi71b6tCo,Rayland Givens gets hit again.,2024-11-28,1316020,28485,234,Evan086
US,1,YlzwOjvLJjY,Chen passed the Bradford test!,2024-11-28,2355872,109878,80,大叔很忙
US,1,uzVkEYJD05M,Matt gaetz on the view face_with_tears_of_joyface_with_tears_of_joyface_with_tears_of_joy,2024-11-23,1214369,0,2851,FT
US,1,pvPpGLglPcw,Eddie gets a compliment from his mom for helping his brother.,2024-11-26,4369835,469075,333,Nicholeuyjc
US,1,EGM1xrW344s,Battle for the room,2024-11-25,5432328,289328,320,Fadega Apalnes
US,1,5uqzmZM459E,How did Homer get Maggie's limited edition doll,2024-12-01,1526737,72170,71,LittleFunKK
US,1,QJEq_728CFI,All the cyborgs gathered for the competition,2024-11-27,2245202,74689,364,Robot Wow
US,1,yAkCSE_LzNg,What would you say when you suddenly show up?,2024-11-28,806211,49444,131,Dinosaur Movie
US,1,xsuQF59QhuE,Storyboard vs Animation: I got a cat. (shot 20),2024-12-01,964639,136282,382,JaidenAnimations
US,1,FvPph78XVio,This black man has no sense of teamwork.,2024-11-29,951043,42232,202,Riley Movie World
US,1,hXkWiz9H8Lo,Shane Gillis Talks About The South Park Episode About Guitar Hero face_with_tears_of_joyskull,2024-11-27,1597133,59545,568,MSSP Hub
US,1,J6KZl6Ilmt8,Uploader stopped the murderer.,2024-11-18,7905967,578759,611,Connor413
US,1,hKFCDkkZOpY,This ghost is trying to fight against the bad guys,2024-11-26,825344,95494,84,Sake Movies
US,1,abZtsmMUbJo,Digital Circus Episode 4 [TRAILER],2024-11-29,9414531,563232,32917,GLITCH
US,1,TTzoH3qcPfo,I can't be single,2024-11-29,2250198,163592,703,The Land Of Boggs
US,1,2MxIwmeToJY,He's really mad.,2024-11-28,2536608,172056,332,Roamer Movie
US,1,rk5LoxDOysk,MARIO Y FERNANDO ALMADA,2024-11-28,1658425,39213,218,EL CHIVERO DE GUERRERO
US,1,bFrwBHnD-us,Homer's ghost haunts Mr. Burns ghost,2024-11-24,2607339,237969,177,SimpsonsGodfather
US,1,XscWA7DMiqU,Bart Dressing Up As A Soldier face_screaming_in_fear,2024-11-25,2055019,168971,120,Jack Norris
US,1,8RlRPFdjxKQ,Gloria lost the parking ticketface_with_hand_over_mouth,2024-12-03,871137,62459,56,Movies Favourites
US,1,8knqmLw4gbI,The AI that killed Homer,2024-11-24,8711032,642278,513,snappy
US,1,GD9wjMHXFFQ,Here,,,,,853939
US,1,sLuPouiOpek,Nelson targeting Bart,2024-12-02,1143723,53689,63,Cartoon Play
US,1,EK1Ila_MFFc,The mother asked the police to arrest the cousin.,2024-11-24,1353830,107151,395,Cole Classic Movies
US,2,0ex4TJZdauw,Drunk Harley Rider Wants FIGHT With Sportbike! face_screaming_in_fear @VinCode17,2024-11-30,3278823,198457,3790,Something Interesting
US,2,dI4Q5X64ax0,Hit and Run Attempt Fails In The Worst Way Possible! fearful_face,2024-11-21,47648991,3449241,15164,MadStreets
US,2,mtEYWF1uW5k,Heel-toe rev matching is a driving technique used to downshift smoothly,2024-11-26,14234053,464776,3394,Torque Trek
US,2,eSvLBUidoIY,WTF Did I Just See In This INSANE LA Alley..? flushed_face,2024-11-23,19513331,953231,7447,John Hicks
US,2,LD92ePR29A4,Change of plans want,2024-11-24,5224303,492263,1530,Carolina Marie
US,2,fZW7kcm5A0o,V8 LS Swapped Tesla!,2024-11-29,2061795,87073,1468,Auto Rush
US,2,SonM1rtQqzQ,Am I crazy skull_and_crossbonesgrinning_face_with_sweat,2024-11-27,33622690,1467986,14021,Bunny.biiker
US,2,guibstqbMFM,"He didnt pay for road, but need to buy tires woman_shrugging karma?",2024-11-26,3287949,108686,802,Dorothy Lech
US,2,R1moTnvgdV8,Chain to the Rescue! wrench,2024-11-28,4832832,15661,111,Machines In Action
US,2,nuVyY0ua2-Y,Which is best? The Evolution of Clip Removers Through the Years,2024-11-24,11602828,403399,823,Car Lover's Corner
US,2,BM98RKarI98,Is this Junkyard 302 a Roller?,2024-12-01,700494,39017,490,Speed Bump Garage
US,2,yNEnWLh4IDE,Lamborghini vs Smoke face_screaming_in_fear,2024-11-25,55687425,2280694,1406,Topper Guild
US,2,tEBpBppNQKg,Find the drawing thinking_face,2024-11-21,61526785,1576665,3306,IND Troll Reacts
US,2,Jti2s-iA098,Extra Wheel Boosts Off-Road Power,2024-11-23,3279065,36778,268,MrVakel
US,2,scpGtyz6fOQ,Angry old people bully kids on dirt bikes and mom comes to the rescue hundred_points@matthewmclaughlin167,2024-11-27,2791263,243632,3458,MasFace
US,2,9pyRrtfJ0XQ,Dumbass driver messed with the wrong trucker,2024-12-01,782760,49200,211,Backseat Driving
US,2,9t2Tsv7-1mM,"IcWsSb : Check out Used engine, Assembly Used diesel engine!!",2024-11-27,3153945,82641,421,Rafiya Dreamliner
US,2,3ujry7TvwW0,LIVE NEGOTIATION fire FOR A RARE PORSCHE BARN FIND,2024-11-26,730080,36888,567,DODI AUTO SALES
US,2,EDwtSx8M6Ng,Replacing a Tyre Valve without Removing the Tyre,2024-11-19,1765343,38380,619,LR Workshop & Expedition
US,2,AOPBD-zxTZg,Trucker’s Icy Detour Saves the Day!,2024-11-30,583025,16674,528,Trucking Talent
US,2,BefpWubPuUo,Its a Honda tho...,2024-11-23,2498620,67556,751,CruiseXCars
US,2,PeO5eJhukcw,Music first,2024-11-24,5921984,237793,7372,daddy gzzz
US,2,SHaG0yktz_o,Preparing For A Flat On A Trailer,2024-11-23,4228657,111243,536,CROWN CATTLE COMPANY
US,2,tzJdSt2gyiQ,Cómo cambiar un sensor de oxígeno,2024-12-01,1017732,20346,447,HazeGarage
US,2,eNxiLgTsWUU,Amish drifting the horse and buggy,2024-11-27,958471,24810,1654,Motorhive
US,2,HZkIjbwfnfI,What was she sayingthinking_face,2024-11-27,5301921,308706,3191,Moto Moe
US,2,U-nZ7z_gLq4,"What Type of Driver Would Drive Through a Protest? A Mustang, Nissan, or BMW?",2024-11-17,28569159,763001,36450,Knightscrawlerz
US,2,0F7p2AysHrY,Tires Slashed on New Truck - Possible Retaliation,2024-11-15,1595903,28781,1840,Gorilla Pro Customs
US,2,9z2en7l8iBk,street fght highway car driver power autobahn supercars speed drifting4x4 4wd offroad,2024-11-15,5709591,289331,1414,Autobahn Performance
US,2,WNBrskEjRX4,Buying A Peterbilt Semi and Destroying it EP1,2024-11-29,5811668,236685,19682,WhistlinDiesel
US,2,BaZDg44-zuE,This Motorcycle Hits 60 MPH Faster Than You Blink (@stage6.racing.official),2024-11-29,3295602,104517,798,RealPenguin
US,2,jZh-uzKy99M,Angry Dad Mad At Loud Cars At A Car Meet,2024-11-26,766758,45322,515,JohnTalksCars
US,2,H2lsHwxQJ50,Trading An F80 For a G28 M4 smiling_face_with_horns,2024-11-29,1132390,53476,972,George J Saliba
US,2,XXiHhox4deQ,This Is A Car Slip And Slide! (@T.777jani),2024-11-19,7603238,0,2616,Stravion
US,2,WAPckQYgvrE,Having A Driver’s License Is Now Illegal face_with_tears_of_joyface_with_tears_of_joyface_with_tears_of_joy,2024-11-21,2752819,110127,6220,investingexecutives
US,2,fyYU09IUk-0,POV filling your tires with your dad,2024-11-23,5239524,0,3337,Charlie Berens
US,2,RK0nhcaT3so,This is How You Sell Trucks ........,2024-11-26,2595411,64253,1703,Tarkis ZOne Productions
US,2,rPFXX_xENl4,Puppy Rides Motorcycle || ViralHog,2024-11-21,13918074,486832,3350,ViralHog
US,2,wPAsP4fFVm4,Genius Speed Bump System,2024-11-28,1001588,30838,450,Amazing Moments
