region_code,category_id,video_id,title,published_at,view_count,like_count,comment_count,channel_title
IN,15,c9UXge_l3_Y,Watch Jaisalmer Vlog on @Neelam_kukreja smiling_face_with_heart-eyes Part 01 ( Desert Safari ),2024-11-25,1439682,33895,107,Dushyant kukreja
IN,15,LizGekNI7w0,face_with_tears_of_joyഒരു സ്ഥലത്ത് അടങ്ങി ഇരിക്കത്തില്ല |,2024-11-24,231218,20479,105,Reshh vlogs
IN,15,PnGGh0FBIhM,fireവീട്ടിൽ മുള്ളൻപന്നി കയറി... | Prank went “WRONG”,2024-11-27,250766,12805,209,Fishing Freaks
IN,15,0i_RL3T5qsQ,ഫിഷ് ടാങ്കിൽ രാജവെമ്പാല...face_screaming_in_fear | eal fish tank cleaning | eal | native monster fish | yadhu bro,2024-11-26,211120,10013,36,everything YADHU BRO
IN,15,meImNLJvYpg,Supporting Husband | Divya Sreedhar | Milestone Makers |,2024-11-26,123125,2305,15,Milestone Makers
IN,15,BqKilr1c1Tw,CHARACTER SWITCH CHALLENGE performing_artsrolling_on_the_floor_laughing | Ft. Amma zany_face | thejathanguwinking_face,2024-11-22,445415,19148,755,Thejathangu Diaries
IN,15,BODOOxE_XfU,You Have to Choose Between Rich or Smart,2024-11-30,654089,74234,101,THE BROWN SIBLINGS
IN,15,LcnDZudHGyI,Cute Dogs smiling_face_with_heart-eyesdog_face Subscribe @AarnaBhadoriya,2024-11-21,1327725,24517,27,Aarna and Abhay Show
IN,15,RiYK8QXOG4E,Shaadi Ka Free Khana face_with_tears_of_joy | Deep Kaur |,2024-11-27,409643,27686,14,Official Deep Kaur Shorts
IN,15,1Chja_S7b4U,Lunahloudly_crying_face pinched_fingers_light_skin_tone,2024-11-30,118762,7541,41,Kunjaatta Malu's World
IN,15,inH41VfPU3k,Shalini Passi Eats What Her Dog Eats! | Curly Tales,2024-12-01,281507,10854,96,Curly Tales
IN,15,fbe4J3R8NOM,Business start chesthunam partying_facepartying_face,2024-11-29,210607,21452,1131,preeethi priya official
IN,15,VCyxrm6w570,ఏకంగా ఓ ఊరినే భయపెడుతున్న కొండముచ్చు : @TV9TeluguDigital,2024-12-01,49518,0,5,TV9 Telugu Digital
IN,15,GD3c9gChnc4,எல்லோருக்கும் கிடைப்பதில்லை pensive_face,2024-11-21,388755,25738,234,rekselva family atrocities
IN,15,1W5e5izsaUo,backhand_index_pointing_up_light_skin_tonebackhand_index_pointing_up_light_skin_tonewarning𝐖𝐚𝐭𝐜𝐡 𝐅𝐮𝐥𝐥 𝐕𝐢𝐝𝐞𝐨 backhand_index_pointing_up_light_skin_tonebackhand_index_pointing_up_light_skin_tone|,2024-11-24,237649,9642,558,ABN Achu
IN,15,Dy1FJ4B5--4,We all made that embarrassing email as kids,2024-11-21,654756,57693,58,Neetesh Praliya
IN,15,HGNSvBg5_vs,Don't Throw It!raised_hand It's A Surprise Snack For The Squirrel!chipmunkchestnut,2024-11-15,10919670,125711,46,Oscar's Funny World
IN,15,6Rv32z9xIJ4,Estate-ல் களமிறங்கிய காட்டு யானை; மரத்தில் ஏறிய Workers,2024-11-29,94045,1861,19,BBC News Tamil
IN,15,teRJtdaTpn0,shipகப்பல்ல பெரிய மீன் மாட்டிகிச்சு! fishWe caught big fish on shipwater_wave,2024-11-15,1170941,59271,620,Sailor Maruthi
IN,15,RWJcUSUbshE,പെറ്റ്സ്റ്റേഷന്റെ പുതിയ സ്ഥലം.. Updated Petstation,2024-11-30,106771,4850,412,Petstationkannur
IN,15,oeUrPcKNW44,ഇതിലും variety food സ്വപ്നങ്ങളിൽ മാത്രം face_holding_back_tears@365storiesbyme,2024-11-16,621003,26154,14,Sharath Joy
IN,15,f0_mhKFM7oU,എന്റെ അനിയൻ എവിടെ?അവനുമായി ഒരു ബന്ധവുമില്ലേ?thinking_face|Ashina Ajmalred_heart|Nov 30 2024,2024-11-30,126497,1453,186,Ashina Ajmal
IN,15,Fn1FrxVCqRM,ഇപ്പോ ഇവിടെ ഇങ്ങനെയാ എപ്പോ ചിരിക്കും എപ്പോ കരയും എന്ന് ഞങ്ങൾക്ക് തന്നെ അറിയില്ല pensive_face,2024-11-27,218569,5067,148,Unnivava Vlogs
IN,15,EkR6tOgASmM,Real Story..loudly_crying_faceloudly_crying_facefolded_hands,2024-11-07,5296585,161270,204,Upendragani shorts vlogs
IN,15,36rKuHPFfOQ,fishing trendingshorts  viralvideo reels teluguvlogs fishinglife cooking trending ￼￼,2024-11-06,5761263,365561,1992,local Boi Nani
IN,15,nL9sKjd2-tk,സുൽത്താൻ നജീബ്,2024-11-19,310865,9704,38,shanu p aliyar
IN,15,xAuXK7Xeibk,അങ്ങനെ അനിയനെ കാണാൻ ഞങ്ങൾ ചേച്ചിമ്മാർ ദുബായിലോട്ടു partying_faceface_blowing_a_kiss,2024-11-26,67926,2888,14,Neethuzzz Creations
IN,15,9q-h-m5cgkc,Jackie Shroff Feeds Haldi Milk To His Doggo In This CUTE Video face_holding_back_tears |,2024-11-23,948934,24820,140,PINKVILLA
IN,15,G0g9r_KAyfk,collisionexploding_headஇப்படி ஆகும்னு நா நினைக்கல..exclamation_question_markanger_symbol,2024-11-07,5286903,457857,8966,Aarif's MindVoice
IN,15,ZEEpYEc3pPE,waitforlast,2024-11-29,113693,1394,0,Kiran Family Official
IN,15,IgfE7HAXdmo,Oil testnerd_face Who has the clearest skin?smiling_face_with_heart-eyes,2024-11-23,4762298,188538,1498,Diana Belitskay
IN,15,KmKlsL_jRvU,ഹബീബി വെല്‍ക്കം ടു കേരള...ഖത്തറിൽ നിന്ന് കൊച്ചിയിൽ പറന്നിറങ്ങി 'ഇവ' പൂച്ച | Eva Cat,2024-11-28,91348,1337,166,24 News
IN,15,6KmExYZenqs,Puri raat jagna pada hamari ye new bachdi ke liye,2024-11-30,87723,5194,232,Village life with ShivOm Family
IN,15,EAjmZyRuu8w,"Cream’s got the upper hand in splitting the boiled egg, leaving Puff in a scramble!",2024-12-03,677072,39600,107,That Little Puff
IN,15,GET75w_uNFE,Remote control 2 Model Dinosaur Unboxing,2024-11-22,1791309,20774,7,Ruhul Shorts
IN,15,spxOhy0kdM8,"ഞാനൊരു കല്യാണം കഴിച്ചതാ , ഇനി കഴിപ്പിക്കരുത് face_with_tears_of_joysmiling_face_with_hearts അഞ്ചു ജോസഫിന്റെ കല്യാണത്തിന് വന്ന നവ്യ",2024-11-30,54192,753,7,Indian Cinema Gallery (ICG)
IN,15,vEsbeFNK7rk,Paracetamol: హెలికాప్టర్ల నుంచి పారాసిటమల్ జారవిడుస్తూ పాముల్ని చంపుతున్న అమెరికా,2024-11-26,211010,1630,89,BBC News Telugu
IN,15,ACX9xyeZBCc,Antimicrobial Resistance Genes Detected in Poultry from Kerala and Telangana  | V6 Teenmaar,2024-11-30,118546,877,13,V6 News Telugu
IN,15,2NlsCxnfKRo,வீடுதேடி வரும் கிராமத்து கறி... | ஆண்டுக்கு 10 கோடிக்கு வருமானம் ஈட்டும் Navaladi Farm,2024-12-02,46220,667,30,Pasumai Vikatan
IN,15,TXLvvo6w4vo,On ആക്കുമ്പോൾ തന്നെ വരുന്ന ആ call relieved_face that feelsnowmanbutterfly,2024-11-11,1651628,90033,528,Babithababi
IN,15,ou5mMUkAonw,நெய் பொடி தோசை சுடலாமா smiling_face_with_heart-eyes / Lakshya Vlogs / Lakshya Junction,2024-12-03,36159,1980,26,Lakshya Junction
IN,15,QAzEFB7AgUA,അപ്പം ഇച്ചിരി മുറ്റ് അഹ് face_screaming_in_fearwhat i ate in Vandey Bharat monorail,2024-11-21,583221,47384,72,Glamy Ganga
IN,15,-hpogvFRM2c,யானை எப்படிப்பட்ட விலங்குனு தெரியுமா?  | யானைகள் செய்த அதிர்ச்சியான சம்பவத்த பாருங்க பகுதி -2 elephant,2024-11-20,384583,7983,132,MYSTERIOUS WORLD TAMIL
IN,15,xWaFI_S0y2M,வீட்டின் பின் பக்கம் தெரிந்த உருவம் போனில்  ஜும் செய்து பார்த்தவருக்கு காத்திருந்த அதிர்ச்சி,2024-11-30,105803,1203,34,Social Trend
IN,15,DIawsiqsmic,నేను చిన్నపుపుడు గేలం వేసి చేపలు పట్టెను || ఇప్పుడు ఈ పిల్లోడు ఫిషింగ్ చేస్తున్నాడు,2024-11-15,635912,24627,18,Yash Vlogs
IN,15,NEILIpv4x-w,Awaited Q&A smiling_face_with_open_hands|| Relationship status | Social media income | Marriage plan | Bpharm | English cafe,2024-11-25,192707,4117,434,AYISHA SHAFRIN
IN,15,FfqFSSukUl8,Silly things we have done in at school beaming_face_with_smiling_eyes,2024-11-07,4551425,105307,318,Sharmila George
IN,15,aGsVZkLBTgo,Dadi Dog par kiya kesh rolling_on_the_floor_laughing,2024-11-30,143431,3750,3,RamRamJi
IN,15,In_7k3_YBqo,ഏഴു നിലകളുള്ള വീട്.. നിറയെ പച്ചപ്പ്.. സ്വിമ്മിംഗ്പൂളും..!!പൃഥ്വിയുടെ പുതിയ വീട്..!! l,2024-11-25,134197,0,36,Cine Life
IN,15,SjNtKr8t2eQ,ഇത് എന്ത് തേങ്ങ ആണിത്astonished_face,2024-11-16,537197,25226,71,Sheethal Elzha Official
IN,15,zJFStDQ1x9E,தெய்வானை மிதித்து மறைந்த பாகனுக்கு கடைசி மரியாதை..மனதை உலுக்கும் சோகக்காட்சி,2024-11-20,248192,7280,84,Galatta Tamil | கலாட்டா தமிழ்
IN,15,2kxDoG0UKOk,பாகனை தூக்கி விசிய கோயில் யானை | கோவில்களில் ஏன் யானை வளர்க்கனும் | சித்ரவதைப்படும் யானைகள்,2024-11-19,292393,4980,774,Saattai
IN,15,BAt_VFsy6aI,Beautiful Aquarium Made From Nature | തോട്ടിലെ സാദനങ്ങൾ ഉപയോഗിച്ച് ഉണ്ടാക്കിയ അക്വാറിയം | M4 Tech |,2024-11-15,879069,32683,842,M4 Tech
IN,15,Xsay-z-efBg,It seems impossible to hide from Sonya! smiling_face_with_tear,2024-11-15,7524880,197629,397,Sonyakisa8 TT
IN,15,c7EjQj_MPHE,Vivaan and Tanya ka pet smiling_face_with_halo,2024-11-24,359508,4733,0,seeVi la
IN,15,uVUzS9NuP58,Live location அனுப்பிட்டு எங்க வேணா போங்கface_with_rolling_eyes,2024-11-29,52162,1141,56,Ela Gayu
IN,15,1NsFuBC331Y,Mini Vlog 87 | Slow And Peaceful Morning,2024-11-29,107766,0,0,Sowbaraniya Ramesh
IN,15,LIHllQ6BIsg,Unmaskingred_exclamation_markThis is the reality check_mark_button PRANVPRAVEENfolded_hands_light_skin_tone crying_faceമൃതുല വന്നു വീട് തകർന്നുdouble_exclamation_mark,2024-11-21,532804,7251,1033,WE're IN love
IN,15,vFb2RIusVIg,Me 8 years old every time no reasonsmiling_face_with_tearfire| Part-5,2024-11-21,1740534,0,21,Jagiya the fun
IN,15,6dKJAB2KbY0,Cow Lover smiling_face_with_heartssmiling_face_with_hearts,2024-11-30,269653,3770,0,The BN Family
IN,15,RS_sq7URJ_M,When you have a blessing heart_suit,2024-11-27,1200917,108672,615,Being Suku
IN,15,ajfpHYJ6Sck,நாயை வளர்த்து.. நாயால் சாவு.. சென்னையில் நடந்த கொடூர மரணம் பதறவைக்கும் லைவ் விசிட்...,2024-12-02,24710,178,62,Thanthi TV
IN,15,w8WDmHY5U98,மைண்ட்வாய்ஸ் ஜாஸ்தியா இருக்கே..rolling_on_the_floor_laughingrolling_on_the_floor_laughing,2024-11-11,1129819,51533,553,Aadukaali Kudumbam
IN,15,vcgj_dUEo3A,Wait for end face_with_tears_of_joyastonished_facewinking_face_with_tongue,2024-11-03,11254464,100727,46,ashok soni vlogs
IN,15,UNIS-1FFrVU,Meet & Greet face_screaming_in_fear,2024-11-26,775129,64793,414,Crafter Aditi
IN,15,cIybYAeGgZ4,Bangla News: সন্ধ্যায় খাবার না পেলেই সিং নিয়ে দেখায় গোঁসা! Funny Animal | VIRAL | Bengal,2024-11-24,116422,2688,267,News18 Bangla
IN,15,gAOjF6BLi-0,Tiruchendur Temple Elephant Attack: மதம் பிடிக்காமலே கொன்றது எப்படி?  | Oneindia Tamil,2024-11-19,198188,700,51,Oneindia Tamil
IN,15,DoPIcop3OlA,એક એવું ગામ જ્યાં કૂતરાઓ પણ છે કરોડપતિ !,2024-11-17,247568,4696,9,GSTV NEWS
IN,15,WxgMge552Yc,"Jim Corbett में जानवरों की रखवाली के लिए लगाए CCTV, रिकॉर्डर से महिलाओं के वीडियो बने...",2024-11-29,185415,2257,237,The Lallantop
IN,15,0qQYlL6kBo8,കാട്ടിൽ നിന്നും കിട്ടിയ പന്നി കുട്ടി astonished_face Baby pig from the forest,2024-11-05,2769726,105746,395,Harish Thali
IN,15,dCpovFNfa1g,ഞാൻ കല്യാണം കഴിക്കില്ല relieved_faceകാരണം ഇത് grinning_face,2024-12-02,24119,514,44,Helen of sparta
IN,15,x8N7ToRkI4s,இதுக்கெல்லாம் இப்போ தான் காரணம் தெரியுது | Daily Activities Awareness,2024-11-20,228720,2184,85,Theneer Idaivelai
IN,15,EANw2kPpQxM,disappointed_faceநீங்கள் கேட்ட கேள்விக்கு பதில் disappointed_face வாழ்க்கைல இவ்வளோ கஷ்டமா face_with_open_mouthface_with_open_mouthface_with_open_mouth,2024-11-26,42866,1657,44,Siva Madhu yoga
IN,15,IiB6eYG-Klw,రక్తం మరిగిన బెబ్బులి వరుస దాడులతో హడల్  | Tiger Attacks - TV9,2024-11-30,22204,136,6,TV9 Telugu Live
IN,15,HefB23r8ktA,A Day at Farm|ప్రకృతి జీవనం| BLIKEBINDU,2024-11-28,60937,1324,211,B Like BINDU
IN,15,uX_wl9eNtcI,கோவத்தில் அருள்enraged_face இவங்க பார்க்க வரலன்னு கஷ்டமா தான் இருக்குdisappointed_face,2024-11-24,127438,2837,59,Laksh Arul channel
IN,15,NcCYwBiXdGw,നാളെ തുടങ്ങും ഓടി വന്നു join ചെയ്തോളൂ,2024-12-01,34250,891,10,Vijay Maadhhav
IN,15,RxdLPogoFPM,Magic Toy For Chottudog_facepaw_prints,2024-11-05,1623331,54415,104,Alrins Tech
IN,15,ifNhahcyxxU,മെലിഞ്ഞ ശരീരമാണെന്ന് ഇനി ആരും പറയരുത് face_screaming_in_fearfire,2024-11-15,241666,21550,82,TECH JUNIORS
IN,15,VZMYfyZkzQo,పల్లెటూర్లో పాము వస్తే ఇలా చేస్తారా,2024-11-07,1491887,20002,17,Village Vihari
IN,15,0SUWfKKd--4,നാത്തൂൻ നാത്തൂന് മൈലാഞ്ചി ഇടൽ ചടങ്ങ്smiling_face_with_sunglasses,2024-11-24,120534,3009,25,jilshad vallapuzha Official
IN,15,blSbv-wGL9g,Indian Army rescues bear in Boarder: దేశాన్నే కాదు.. మూగజీవులనూ కాపాడుతుంది ఇండియన్ ఆర్మీ,2024-11-22,336114,4306,373,Asianet News Telugu
IN,15,-Qn9H4IkjOw,Zera baby heart_suit,2024-11-01,4430246,115695,512,Alice Christy
IN,15,-uEkRS-Mo_M,పెంచలకోనలో చిరుతపులి సంచారం,2024-11-28,45758,307,0,ETV Andhra Pradesh
IN,15,Gda0ddaXqDM,പ്രതീക്ഷിക്കാത്ത വിജയം കണ്ണ് നിറക്കുംpleading_facesmiling_face_with_hearts,2024-11-10,627636,17343,67,Anshi's Vlogs
IN,15,rek80VjKMPg,China के इन विशाल गड्ढों के अंदर बसी है एक अनोखी और रहस्यमयी दुनिया (BBC Hindi),2024-11-28,249672,0,220,BBC News Hindi
IN,15,CTWC4uoT6iY,Neetu Bisht is live,2024-12-01,55548,2640,366,Neetu Bisht
IN,15,aOSSBYrtezw,ഉമ്മച്ചൻ revolving_hearts,2024-11-25,105187,7386,138,Njangal Inganokkeya
IN,15,7muem3a7wYg,IRRITATING COCO enraged_faceface_with_symbols_on_mouthface_with_tears_of_joy,2024-11-28,75582,8169,90,Dad's Life
IN,15,CmN5oLDScGE,എല്ലം കഴിഞ്ഞു ബസ്സിൽ കയറിയപ്പോഴാണ് അവൾ അറിയുന്നത്face_screaming_in_fear,2024-11-21,114515,6932,25,Wayanadan Vloger
IN,15,VEdKmuzjwcg,Good newssmiling_face_with_hearts & Sad newscrying_face நம்ம வீட்டு function Start ஆகிருச்சு smiling_face_with_halo கார் இப்படி ஆகும்னு நினைக்கவே இல்ல crying_face,2024-11-29,30816,1125,19,UdhayaSumathi samkutty Official
IN,15,yA7HoSh2Wt0,വീട്ടിക്കു ഇപ്പോള ഒരു ഉപകാരം ആയത് grinning_squinting_facegrinning_squinting_faceഅടിപൊളി hundred_points,2024-11-05,1201462,49644,168,Pk Couples
IN,15,Gc84KJ4tFYU,2 Puppies వెళ్లిపోయాయి crying_face || Shih Tzu Puppies || Lasya Talks,2024-11-18,188757,2818,521,Lasya Talks
IN,15,7_rBMMnE8H8,Shaadi kab kar rahe ho?upside-down_face| Princy parikh,2024-11-03,4395044,255669,1099,Princy Parikh
IN,15,vXfcJVJFoBc,நட்புக்கு இலக்கணம் நாய்க்கு குவியும் பாராட்டு,2024-11-06,1294821,42440,181,Dinamalar
IN,15,rLS-GMDfjI0,Are we still in 2024 at least? flushed_facealarm_clock,2024-12-02,462653,35000,151,Victoria Pfeifer
IN,15,wh2hheo4MIs,ఇలాంటి Come back ఇస్తాను అని అనుకోలేదు నేను || Sreemukhi ||,2024-11-28,55166,1439,15,Sreemukhi
IN,15,Q1FiaihV0GU,అడవిలో ఎదురుపడ్డ పులి ఫారెస్ట్ గార్డ్ ఏం చేశాడంటే..! | Forest Guard Close Encounter with Tiger | ABN,2024-11-26,57182,395,8,ABN Digital Exclusives
IN,15,oIjIlwjET2M,கொட்டும் அடை  மழையில் ஓயாமல் நடக்கும்  சேவை / 6 மாதத்தில்  கணவர் மற்றும் மகனை இழந்த குடும்பத்துக்கு,2024-11-28,21723,661,61,My Country Foods
IN,15,jvpf8suiwlU,HOME TOUR 1st floor and penthouse YouTube:Cherry sathakshiStarting weight -110.1kg Current weig,2024-11-21,193127,5825,0,Cherry Sathakshi
IN,15,ISFYBiUnJZM,ഇനി ഇവിടെ കൂടാമെന്ന് ബുള്‍ ബുളും കുടുംബവും; ഇറക്കിവിടാതെ വീട്ടുകാര്‍ |Kozhikode | Bul Bul,2024-12-01,16334,206,32,Manorama News
IN,15,UNVXg--tXJA,Mampi gir gai pani m,2024-11-16,490145,14301,77,Rahul. Mampi
IN,15,dOmNM6UhteU,our new homesmiling_face_with_hearts @RoshensVlog @lerashivlog,2024-11-08,672320,19534,99,le rashi
IN,15,I-6s098hhys,"പാകം ചെയ്താലും ചിക്കന്‍ സേഫല്ല,മരുന്നിലും ജീവിക്കുന്ന ബാക്ടീരിയ, ജാഗ്രത | Broiler chicken | ICMR",2024-11-22,82047,473,41,Keralakaumudi News
IN,15,s89Q-U0O0tQ,zamelectproperties,2024-11-29,278616,24022,269,ZAMZAM ELECTRONICS TRADING
IN,15,wfyBFEi3CjI,1 हाथी कितने केले खायेगा ?thinking_face 1 Elephant = How Much Bananas ?,2024-11-17,525079,33643,1091,MR. INDIAN HACKER shorts
IN,15,hizpk8HsUDA,high_voltagehigh_voltageవీటితో డబ్బులు సంపాదిస్తున్నారు |high_voltageInteresting Facts,2024-10-29,2142879,38906,6,DSK Facts
IN,15,v-pr0H5QgDA,Welcome Home மக்களே - After Long Days ஒரு குட்டி Chit Chat பண்ணுவோமா | Sunita Xpress,2024-11-26,55353,1489,79,Sunita Xpress
IN,15,0tWDgPgzTEE,பாகன் இறந்து 11வது நாள்broken_heartGate-ஐ திறந்து வெளியே வந்த திருச்செந்தூர் யானை செய்த செயல்elephant,2024-11-28,14384,366,5,Galatta Voice
IN,15,7bjuVYn7qt4,മകൾ loudly_crying_face ഇങ്ങനെ ചേർത്ത് പിടിക്കാൻ ആരുമില്ലാതെ പൊലിഞ്ഞു പോയ എത്ര ജീവിതങ്ങൾ heart_exclamation,2024-11-09,219064,10040,74,B4 AINUUS
IN,15,-HuZapO2zoY,That Love..red_heart,2024-11-06,1173771,51573,593,SUHAIL - VLOGGER
IN,15,H_sQ3GZVlzQ,ഈയൊരു,2024-11-01,1154512,27056,32,Tiya & Advik Chathamkulam NimishaRajeesh Vlogs
IN,15,0gJvFzCaaQg,അനുഭവം ഉണ്ടോ beaming_face_with_smiling_eyes,2024-11-01,1316727,20327,183,farooq malappuram vlog
IN,15,DfukUGobSFY,Tigers Fear Adilabad District Ground Report | ఉమ్మడి ఆదిలాబాద్ ను వణికిస్తున్న పెద్దపులులు | ABP,2024-11-21,50119,264,12,ABP Desam
IN,15,RZOai7bGewE,India's 56th Tiger Reserve | Daily Current News | Drishti IAS,2024-11-19,233525,11649,855,Drishti IAS
IN,15,esoCN8gk6i4,പുലിയ കുടുക്കിയ നാട്ടുകാരുടെ ഹീറോ,2024-11-15,100884,968,32,GCN NEWS
IN,15,DCmj0e6qPiQ,Hostel kastalu sad_but_relieved_facesad_but_relieved_face,2024-11-11,98438,1061,15,CHINNU_6542
IN,15,dvkIAH_Mw-g,"Tiger को देख पेड़ पर चढ़ गया चौकीदार लेकिन बाघ लगातार घूरते हुए चक्कर काटता रहा, Video Viral !",2024-10-29,1127770,7583,402,MP Tak
IN,20,zFvyMwTIfRk,THE ULTIMATE POOR TO RICH SHOP MAKEOVER | MOTEL MANAGER GAMEPLAY,2024-12-03,3091067,181182,8928,Techno Gamerz
IN,20,EcDkJ5g-1gw,Opposite Flying Hacker exploding_head Don't Miss The End skull,2024-12-03,156294,28905,115,AKSHAY AKZ
IN,20,yNe2gszqdDk,THE END OF KING enraged_face Lilyville Day 57,2024-12-03,1009799,89684,1507,GamerFleet
IN,20,usFwYACPyh4,ULTIMATE ROYALE & CLASSIC RANK PUSH | CONQUEROR OR WHAT | BGMI LIVE,2024-12-03,585684,43230,136,LoLzZz Gaming
IN,20,n8-srlSmT_I,I Made EVIL CLONES Of Myself To Annoy Villagers!,2024-12-03,302498,6045,358,Carry Depie
IN,20,097OTvJZqXg,MAGIC CUBE STORE UPDATE India Garena Free Fire,2024-12-03,128094,16170,664,STAR GAMERS
IN,20,O6Dc4dB8xHI,Franklin Play Hide and Kill in Indian Bike Driving 3D,2024-12-02,570089,3697,105,HarshTatsuya
IN,20,tVNigEo-MXE,SURVIVING 100 DAYS in Realistic Minecraft World [ft. Friends],2024-12-02,574632,37227,1927,YesSmartyPie
IN,20,GTAmDirq4wI,HOW TO UPDATE FREE FIRE MAX | 4 DECEMBER NEW UPDATE KAISE KARE | OB46 UPDATE FREE FIRE | NEW UPDATE,2024-12-03,69425,3651,127,JEROX GAMING
IN,20,8j9At9NOOKk,TREVOR KILLED DRUG DEALER JOHNNY K (HINDI DUBBED) | GTA 5 GAMEPLAY PART 7,2024-12-02,734186,63159,11462,Total Gaming
IN,20,M8Mur6QjaRE,red_circle[Live] Day 33fireBr New Rank Season - 42  Road to Top-1fire24 Hourshot_face,2024-12-03,302010,6332,0,ABHISHEK YT
IN,20,xACP1-KeKKs,$1 vs $100000 MANSION IN DUBAI CITY | MINECRAFT,2024-12-03,125149,6683,380,Chapati Hindustani Gamer
IN,20,Yt3TOVuBgTQ,sharpppp,2024-12-03,69669,6840,21,Sayip0P
IN,20,PDX_gulFVdE,OB47 MAINTENANCE BREAK FULL DETAILS FREE FIRE IN TAMIL || NEW FREE FIRE OB47 PATCH UPDATE IN TAMIL,2024-12-03,43100,5287,389,HIT TAMIZHA GAMING
IN,20,DaqWDDoLvC4,Aao Face To Face  Khele | GTA V,2024-12-03,112947,12038,26,shreeman legend live
IN,20,Bl0e5D5zT8g,I AM BACK call_me_hand,2024-12-03,174297,16689,946,Desi Army
IN,20,B9Cpfk6LOWs,Godlike Antaryami is Live Bgmi,2024-12-03,168914,12148,25,Antaryami Gaming
IN,20,e0woLyeA5Cc,I MEET DJ ALOK IN REAL LIFE fire,2024-12-01,1002734,83456,3771,Desi Gamers
IN,20,SOoNaB0shFY,Chilla's Art - The Karaoke Horror Game,2024-12-01,868473,45462,2691,Live Insaan
IN,20,335I6hzfGvM,red_circle[Live] New Rank SeasonalienRoad To Top 1fire-Garena Free Firefire!!,2024-12-02,880109,18494,84,UnGraduate Gamer
IN,20,vzrWAE4ZZ1A,Franklin & Shinchan Travel To Other World Through Portal in GTA 5 ! (GTA 5 mods),2024-12-02,330377,10328,458,Flight Gamer
IN,20,uiIu_BEvBJY,"New Major Update This Thursday-Officialcheck_mark_button EFOOTBALL 25 | Captain Tsubasa Collabface_screaming_in_fear, FreeTry & Ability",2024-12-03,53526,5125,402,BLACK MAMBA GAMING
IN,20,c4Pkmc4vczQ,Franklin Uses Magical Painting To Become Biggest Most Popular Gang Leader In Gta 5!,2024-12-03,71836,1291,73,Krishna Flight
IN,20,Hsjwmucldk8,Exposing Scariest Entity Secrets In Minecraftface_screaming_in_fearskull,2024-12-03,86504,2822,103,MineFlux
IN,20,mDrmBbPjjjc,police_car_lightTriple Store Update Free Fire l MagicCube Store Update exploding_head| OB47 Free Rewardswrench | OB47 Update Detailshundred_points,2024-12-04,17268,3658,258,TELUGU PROS
IN,20,y1S9vIGRJG8,red_circle SRM GAMING ON LIVE red_circle,2024-12-03,110581,2014,4,SRM
IN,20,8fBEG7cqB64,red_circleLIVE Unq Gamer | Pubg Mobile Punju VS Petta | Live Stream,2024-12-03,49883,3369,0,Unq Gamer
IN,20,iAtGwcho-gs,REAL MADRID 2 - 0 GETAFE CF I RESUMEN LALIGA EA SPORTS,2024-12-01,3686078,70499,1913,LALIGA EA SPORTS
IN,20,WbJRaU3tXDE,Best AWM Gameplay OF 2024face_screaming_in_fear 25 Kills | Free Fire Max,2024-12-02,207855,18089,610,Badge 99
IN,20,cLkXzBBYTqM,I Opened a Mob Zoo in Minecraft,2024-12-03,73638,2065,120,Mc flame
IN,20,haz_3ENzBRA,fireFirst day of Ultimate Royal Mode in BGMI - Top 500 Rank Intense Clutches in BGMI,2024-12-03,75641,7298,179,BandookBaaz
IN,20,kYD6T5DK7J0,"Level 1 GHOST RIDER to Level 1,000,000,000 GHOST RIDER in GTA 5",2024-12-01,441934,4571,103,TheLoudDude
IN,20,6L2DfGHnMXo,Kelly Show: S05E05 | English | Patch Updates OB47 | Free Fire MAX,2024-11-30,3968838,45369,2810,Free Fire India Official
IN,20,KKPZ13sjBXY,V Badge Player Gaya Vending Machine Ke Andarastonished_face| Phir Dekho Kya Huaaface_with_tears_of_joy| Must Watch |,2024-12-01,114940,12021,29,FF Balvant Gaming
IN,20,cMCpCSHSwy0,Birthday Gift To Sunny partying_face Buying All New Bundles In Free Fire | Luckiest Day - Free Fire,2024-12-02,187038,12117,1060,AS Gaming
