region_code,category_id,video_id,title,published_at,view_count,like_count,comment_count,channel_title
GB,2,eNxiLgTsWUU,Amish drifting the horse and buggy,2024-11-27,958471,24810,1654,Motorhive
GB,2,8_uUnjnCcSE,OHH hushed_faceskull,2024-11-30,2728377,160109,3140,UNISH EDIT
GB,2,4M97JCPf5u8,How to Spot Engine Leaks Fast,2024-11-22,7571984,111616,1773,Genius Club
GB,2,1QtzC5uokrY,Камаз дрифтил до приезда ДПСface_screaming_in_fearface_with_tears_of_joy,2024-11-27,4726044,274550,2040,Мистер Всезнайкин Shorts
GB,2,mIwLGQf4mjU,A Tiny Robot That Moves Cars!,2024-11-06,3145291,0,331,Craftsflare
GB,2,nI5lDCMS1OE,This machine can print road markings 10 times faster,2024-11-22,2137192,24863,1667,Unstoppable Gadgets
GB,2,4TlSHAX5Wds,Lambo Owner Educates Copsflushed_face,2024-11-21,2201705,130415,1073,Cops Mental
GB,2,jZh-uzKy99M,Angry Dad Mad At Loud Cars At A Car Meet,2024-11-26,766758,45323,515,JohnTalksCars
GB,2,XOUUsvMm1PM,Is This Car Even Real.. exploding_head skull,2024-11-25,16144195,950585,1363,Alone Believer
GB,2,scpGtyz6fOQ,Angry old people bully kids on dirt bikes and mom comes to the rescue hundred_points@matthewmclaughlin167,2024-11-27,2791263,243632,3458,MasFace
GB,2,xi-lcTZA8Wg,Украли фары средь бела дня ninjalight_bulboncoming_automobile,2024-12-01,1862353,76062,309,Gelik Shorts | Лучшие Авто Видео из России
GB,2,-vwZPxyb0sE,street highway car driver power autobahn supercars speed drifting4x4 4wd offroad,2024-11-15,9933744,662951,8092,Autobahn Performance
GB,2,X4rwn5oQHxM,"MY £200,000 LAMBORGHINI WAS STOLEN!",2024-11-26,1161474,29785,1771,Mark McCann
GB,2,gp-4U9IDygw,When a Bear Breaks your Lamborghini Door,2024-11-26,1553045,86844,1770,Exotic Rubber
GB,2,vRm8O3FQ2vo,How To Beat Car Insurance,2024-12-03,326183,20720,186,Mark Tilbury
GB,2,_Dbi8UMwLdU,Вы точно не знали этих советов для подбора авто!.. face_holding_back_tearsred_heart,2024-11-30,4420614,132136,205,Пин
GB,2,fl2DNzREyog,Testing Our Dream Cars VS The Cheapest Car,2024-12-02,290283,16584,899,Top Dead Center
GB,2,QQSUyiFUCCQ,REBUILDING MY WRECKED MCLAREN THAT WAS UPSIDE DOWN,2024-12-02,232855,14764,479,Chris Slix
GB,2,egp_Dw1e0mk,She was on her phone and hit a 1 of 1 car flushed_face,2024-11-25,1139353,16540,1898,Car Community
GB,2,yOR9KuX0N48,Rider saves the day,2024-11-16,18030061,614670,1979,Saiyan Army Motorsports
GB,2,RK0nhcaT3so,This is How You Sell Trucks ........,2024-11-26,2595411,64254,1703,Tarkis ZOne Productions
GB,2,2JOvxDwZvuI,You can't choose gears better than an auto!,2024-11-24,376270,14865,628,Mick Drives Cars
GB,2,WNBrskEjRX4,Buying A Peterbilt Semi and Destroying it EP1,2024-11-29,5811668,236685,19683,WhistlinDiesel
GB,2,kjj7clTScpg,Biker Tries To Impress This Girl,2024-11-29,970769,0,68,Alex Bennett
GB,2,4jQ8W4Zm-ZE,Times BIKERS Had A Different Ending In Mind,2024-11-30,1084816,16302,28,RevVerse
GB,2,Tnln9oO_z8A,Dirt bike rider does 180° whip! exploding_head,2024-11-24,1728169,86108,709,Nick Tomasunas
GB,2,2Y2hnqMBgEA,Truck Driver Accelerates to Stabilize Swerving Trailer,2024-12-01,669061,19529,124,David Wilson Stories
GB,2,yUjMGQKh2FQ,He’s the smartest trucker ever face_with_peeking_eye,2024-11-16,9862990,391617,1577,Motherland's Angels
GB,2,5h863qOOyVU,Скиллы мотоциклистовface_screaming_in_fear,2024-11-27,2947116,86276,40,MOTO-SHORTS
GB,2,0mOtmsppv4U,This Dumper Driver Showed Great Skills!,2024-11-23,2082352,27809,148,Sara's Creative Home
GB,2,wEYeb7g2Uo0,An ordinary day for a nut_and_boltmechanicgear...,2024-11-26,2396753,22356,19,ReactSphera
GB,2,H6sR6vLO-5w,Опасная ситуация..,2024-11-25,7571341,88162,1267,Мурат 07 манипулятор
GB,2,AGyM4sCVflQ,It's Been Stated That You Are In Possession Of A Knuckle Duster astonished_facemovie_cameraflying_saucercross_mark,2024-12-01,133007,5956,1445,DJ AUDITS
GB,2,synzoZwG070,Автомобиль распознал скрытый патруль в Дубае,2024-11-22,12771883,464866,921,ЛАЙФСТОРИ
GB,2,wc0wmgIMLjA,Meet Ricky's MONSTER M3 Touring 1400BHP,2024-12-01,188922,6783,468,MSB Michael Schublacker
GB,2,QWuu3AhLFrU,Now They Don’t Fool Anyone While Fuel Filling smirking_face !!!,2024-11-20,4829361,0,615,Echelon world
GB,2,aMDyrmvh0vw,When Street Guys try OFFROAD..,2024-11-24,3209066,117989,123,Dirtbiketrick
GB,2,QzGlTULmheI,FIRST LOOK: Jaguar Type 00 – Let The Chaos Begin!,2024-12-03,261835,5158,4245,Top Gear
GB,2,UXWJRd1P16E,REMOVING A CAMPER FROM A CAMPSITE WITH A 32 TONNE WRECKER |,2024-12-03,99360,5053,518,Trucker Tim
GB,2,E2Lvxq92S7U,WE MODIFIED OUR CHEAP PICK UP TRUCKS!,2024-11-28,317835,19533,904,Autoalex Cars
GB,2,4iC0LD2T634,WINNER WINNER 2024 BARGAIN SALVAGE CLIO WE STOLE FROM COPART PT4,2024-12-01,106506,10736,407,salvage rebuilds uk
GB,2,8qn2kr72OhE,The Peugeot 108 days will be in my documentary as some of the greatest speaking_headshushing_face,2024-11-16,1400016,55483,498,Diego Day
GB,2,yJouavMh6oo,Tesla racing against the Audi R8…grinning_face_with_sweatracing_car,2024-11-30,223293,11653,271,The Grand House
GB,2,fyYU09IUk-0,POV filling your tires with your dad,2024-11-23,5239524,0,3337,Charlie Berens
GB,2,EDwtSx8M6Ng,Replacing a Tyre Valve without Removing the Tyre,2024-11-19,1765343,38380,619,LR Workshop & Expedition
GB,2,KxWKfZANZJE,Giving Sister’s Mercedes a Devious Tune Up,2024-11-27,1456550,103526,703,SaucyTV
GB,2,H5bIy2mKi4U,When I was Learning to Drive in the Winter,2024-11-22,2152738,190498,290,HumorLex
GB,2,VkJTBZNVhrg,Genesis ￼GV80 | Paintless Dent Removal,2024-11-22,2500738,162908,176,American Dent Specialists
GB,2,7hJFgLSBWuU,Uk roadman roadrage,2024-11-24,180963,4078,847,DailyRage
GB,2,En9jXRYpQEU,Does a Tesla charge faster than a Rivian Short,2024-11-24,3576537,104959,671,Desmond Dennis
GB,2,0cDe9NBhBmE,КАК ПОМЫТЬ АВТО ЗА 100₽ !!!,2024-11-25,4124321,172062,845,Aleksdi_official
GB,2,xEcnpAMP_KI,У кого было также? Пишите в комментариях winking_faceface_with_tears_of_joy,2024-11-20,10455810,409154,1611,PICKPLUS_CIS
GB,2,35ZM_K3CSm0,Woman vs Lambo Owner,2024-11-25,1198737,52639,475,Viralform
GB,2,vRMsHopyqw8,Man Warns Electric Biker,2024-11-07,39687598,2206746,35549,Reality Revealed
GB,2,SHaG0yktz_o,Preparing For A Flat On A Trailer,2024-11-23,4228657,111244,536,CROWN CATTLE COMPANY
GB,2,e3BGDk4xCAE,Cars Braking Down in The Middle of Nowhere..,2024-12-02,477875,20381,61,cartricks
GB,2,W5id_QYH4dk,flushed_faceТАКИХ АВТОМОБИЛЕЙ БОЛЬШЕ НЕ ДЕЛАЮТflushed_face,2024-11-29,2502875,51069,398,АВТО БОТ
GB,2,DaP0t4HmQdk,i bought WHAT for my NEW CAR?face_with_open_eyes_and_hand_over_mouthflushed_face,2024-11-26,1324073,72022,546,JUSTKASS
GB,2,JwkjkRcBqUM,New slickback sound ? thinking_facefire,2024-12-02,674788,37456,805,TheJiggyPrince
GB,2,m5QuWtAN8Ug,This job would not be fun without this guys grinning_face_with_sweat,2024-11-21,5495865,120828,968,Bandita Drive
GB,2,d4ELzZ8mnYs,Buddy indeed did not hit the brake…,2024-12-02,290849,7677,89,Zay Solis
GB,2,Q5jiHaxmWEs,Testing If A Bubble Can Protect My Mclaren,2024-11-16,16924205,780657,3903,Asher Lara
GB,2,WbHx9BzIOwI,"LookeyesAt Her How She Is LookingeyesMe,,firefiremotorcycle",2024-11-18,30152969,789337,1344,PHINO RIDER
GB,2,JSGWiJDl9LI,Car Guys Go Cheap Mode,2024-11-20,3923754,287169,112,Car Boys
GB,2,nIq2AhE7aqo,The World’s Fastest Honda EK Coupe exploding_head,2024-12-03,332028,18649,340,Street Alpha Podcast
GB,2,Zqt7_sd_Sgo,Jaguar Type 00 | Copy Nothing Miami,2024-12-03,176556,0,3171,Jaguar
GB,2,I_HvZji7-LE,Te mit tennél ebben a helyzetben? | What would you do?,2024-11-24,5164327,185927,930,SMC
GB,2,61Wi57Wqyxs,bmw m2 bmwm2 fail tailofthedragon youtube shorts carshorts f80 m3 bmwm3 f80m3 crash,2024-11-27,691074,8740,510,F80 Trevor
GB,2,Zmu_ys0KnmI,Issues With My Cybertruck,2024-11-26,394485,9553,1026,Yiannimize
GB,2,eDHnsbTXnEE,The Baby Ferrari of Hammond...squinting_face_with_tonguegrinning_face_with_big_eyes,2024-12-01,69778,3882,9,CarHome
GB,2,vlPBMasTZT0,Impatient Driver Cuts Off Traffic & SLAMS Into Building!office_buildingfearful_face,2024-11-18,597645,23564,1457,ExposedOnCamera
GB,2,tFFidJr4Iw0,Race Cars vs. Eau Rouge Flat Out,2024-11-24,617499,44535,364,AaronRheins2
GB,2,BM98RKarI98,Is this Junkyard 302 a Roller?,2024-12-01,700494,39018,490,Speed Bump Garage
GB,2,H4mIErV1TEc,How is your Thanksgiving? Eating Turkey or unwrapping new 911?.,2024-11-28,517316,15455,329,Porsche from Samuel
GB,2,6ZnsL1m184Q,Chris Harris on Cars: Ferrari Purosangue. What to make of Ferrari’s SUV?,2024-12-01,290650,14207,1102,Chris Harris on Cars
GB,2,FXZdl0GPwfw,I Put Christmas Lights on My Lamborghini! @mckinleyrichardsonnn @michellexscott,2024-11-26,975549,15094,173,Jack Doherty
GB,2,bTVQlsyAn68,Самая заниженная НИВА,2024-11-21,11324258,443146,3135,Andrew Glazunov
GB,2,c2aB9L-rwSg,Главная проблема Мерса,2024-11-29,1164693,48076,124,narezkatopgear
GB,2,dpUSVCKHPcs,Running car in truck,2024-11-17,3978939,57454,490,ASTROZEN
GB,2,WAPckQYgvrE,Having A Driver’s License Is Now Illegal face_with_tears_of_joyface_with_tears_of_joyface_with_tears_of_joy,2024-11-21,2752819,110127,6220,investingexecutives
GB,2,AOPBD-zxTZg,Trucker’s Icy Detour Saves the Day!,2024-11-30,583025,16674,528,Trucking Talent
GB,2,WepvOteCWoo,where's my car?,2024-12-02,334298,23259,169,Jake Rasmussen
GB,2,8gcLo97PSN8,*HOW TO TURN RIGHT ON A ROUNDABOUT*,2024-11-27,200175,13556,95,Clearview Driving
GB,2,QpxvO53t2BY,Found Stolen Bike thinking_faceflushed_face,2024-11-22,1896350,126164,316,Insane Bikerz
GB,2,sohjnE-8Vug,PORSCHE REFUSED TO SELL ME A GT3RS - FULL MOVIE,2024-12-03,122859,5027,381,Mark McCann Mk2
GB,2,5DXbn--cQZk,We had a blast beaming_face_with_smiling_eyes comment for part 2!,2024-11-15,7171976,113520,1322,Grifiix
GB,2,t2ujZatg3X8,I SWAPPED MY KIA CEED GT FOR AN ABANDONED PERFORMANCE CAR,2024-12-02,70963,4864,532,Jesse Collingham
GB,2,z851xrHXvFg,WHY AMERICAN JUNKYARDS ARE THE ULTIMATE DAY OUT!,2024-11-29,217652,11695,315,Autoalex v2
GB,2,xtStJ70kWTw,Bikers Helping Each Other,2024-11-20,2346167,140977,128,Moto Boys
GB,2,pS-fFdvyHLE,How Much Tape To Stop A Lamborghini?,2024-11-08,260207622,7330857,8949,MrBeast
GB,2,93UrKpf3Deo,High Peak Autos Garage Tour | December 2024,2024-12-03,46322,3459,277,High Peak Autos
GB,2,x1wHKfLISYY,Самосвал встал на задние колеса,2024-11-27,4065220,32926,259,ANDROY
GB,2,7SSuTos679g,Ronaldo and Messi’s Fastest Car Battle Ever face_screaming_in_fearfire || Must Watch ||,2024-11-21,3298975,181124,550,Ronaldo Zone
GB,2,uHp3t__GNBs,Tinning of an old weld,2024-11-22,6956786,68252,733,Best Mechanics Around the World
GB,2,q04ObEShAmU,Hassle Free Permanent Tire Repair,2024-11-12,67546138,920799,2296,Mr.Homemade
GB,2,KzcYDjksNpA,Ремонт пластиковой клипсы бампера с помощью стяжек и шайбsmiling_face_with_sunglasses,2024-11-19,19013706,349870,2080,Кувалда.ру LIVE
GB,2,ZbGNOFoQVMI,The Mechanic Hack They Never Told You About!,2024-11-22,2673070,75302,1376,Gearheadbryan
GB,2,T1vvR7Ey9H8,When sportsmanship takes the wheel. automobilesparkles,2024-11-13,8943137,231931,1081,Red Bull Rally
GB,2,EyagJZ421uI,Fixing Everything Wrong With My Rebuilt McLaren 675LT,2024-11-30,376414,17449,540,2varish
GB,2,3zBlGi_SnAA,Testing the Worlds Biggest Four Wheeler,2024-11-29,2324836,71332,5494,CboysTV
GB,2,jO1JbvVAF_s,I SOLD MY M5 AND BOUGHT THIS...,2024-12-01,63380,1986,249,Calvin's Car Diary
GB,2,Od8tiIVsJe0,promise I’ve been a good girl Santa,2024-11-28,635070,8741,99,Motogirl_Shorts-moto
GB,2,yboSoqsamdQ,These cars did NOT want to stop face_with_tears_of_joy,2024-11-09,38525190,1539876,23584,Doza Vlogs
GB,2,XxE9AECGKn8,"I Bought Britain's Cheapest Aston Martin DBS - What Happened Next, And Do I Regret It?",2024-11-30,116872,4314,532,JayEmm on Cars
GB,2,j6DGSg2JVZA,Drive Across The Entire America In Just 26 Hours?,2024-11-21,1723948,142151,291,WiseWheel
GB,2,0ilZnCGyO90,Car Causes Biker To Crash,2024-11-13,10359809,386870,1119,Curbio
GB,2,1qn1LYNSVaA,Я…опять об0ср@лся с 30ти летним Фордомloudly_crying_face,2024-12-01,795381,34642,138,IGORIAN TODAY
GB,2,7IMZQanGhuA,"My bike shut down on top of a 2400 meter mountain in Türkiye Türkiye | S8, EP15",2024-12-01,553296,74077,1910,Itchy Boots
GB,2,xc8sPLcIMNs,Aur_Karo_Ungaliface_with_tears_of_joyrolling_on_the_floor_laughingduke390,2024-11-23,19325894,901434,668,prosenjit vlogs official 10k
GB,2,086nIbHovyA,Tampona l.p.g dolum ağzı montajıı.,2024-11-21,4420489,34061,366,İDRİS USTA
GB,2,DbtcWQXlvHM,Показал девушке как ПРАВИЛЬНО позировать на мотоцикле..grinning_face_with_sweatmotorcycle,2024-11-25,1682218,58071,272,MotoRaido
GB,2,0gnAUITYR_k,Saving two BULLDOZERS From becoming SCRAP! (Caterpillar D8H & HD11),2024-11-30,562943,60799,3124,Diesel Creek
GB,2,eh-e7N4xlKU,Far parlatma işlemi,2024-11-26,2277980,19393,146,Ahmet akçin
GB,2,jBS2xdO3fns,The 2025 Rolls-Royce Cullinan’s Horn Sounds Like Privilege,2024-11-22,1452886,76121,317,MilesPerHr SHORTS
GB,2,tMxehMtjN0A,Are you as excited to see us at Harker Heights Ceramic Coatings as this dog is to see the delivery,2024-11-23,204313,2518,305,Harker Heights Ceramic Coatings
GB,2,etxdQgNLFt4,Kids sneak out to ride bikes bicyclesnowflake,2024-11-15,2133800,55265,447,Šimonb
GB,2,FqVCj3tCI4M,FINALLY Race Day! Battling Our Twin Turbo and Supercharged Shop Trucks!,2024-12-02,1007163,59297,2822,Cleetus McFarland
GB,2,oTwKj0gIdNo,قبل خرید ماشین دست دوم حتما این نکاتو چک کن,2024-11-29,819409,11498,163,حقایق جهان
GB,2,sXhN6IhYJNM,Schumacher's Driving Secrets - He Needed Three Speedometers!,2024-11-14,3325661,151182,482,CarFlex
GB,2,8W13gfo6vpA,Tuc Tuc makes a mess when changing lanes,2024-11-25,925517,7426,70,Simulation Community in english
GB,2,-_Lay7tVxLc,Studentka i jej piorunujący peugeot 206,2024-11-21,1915677,63112,1184,AutoOtwieracz
GB,2,awHFwsNUhes,What do you mean two seater? face_with_tears_of_joyface_with_tears_of_joy,2024-11-10,1520347,94395,1631,deagzzzshorts
GB,2,mWJHI7UHuys,This Is The World's First Geared CVT and It Will Blow Your Mind -  Ratio Zero Transmission,2024-12-01,945698,38317,4006,driving 4 answers
GB,2,T9xFYy9wDKY,Ghost car skull....,2024-11-26,5687933,368293,867,VORTEX EDITZ
GB,2,ZSXpmaid4Lo,Biker Gets Chased After Revving At Pedestrian grimacing_face,2024-11-19,1025935,43237,1347,Street Patrol
GB,2,s8DiH_3xk2U,КТО БЫСТРЕЕ УНИЧТОЖИТ ТАЧКУ? Юра Волков vs НИКИТОС!,2024-11-30,829343,40919,2056,НИКИТОС
GB,2,4VjqxI8tW5o,That almost went REALLY bad man_facepalming_medium_skin_tone,2024-11-22,639406,38988,91,MattsMK5
GB,2,KNK9pApn09o,1 000 новых тягачей,2024-12-01,1284509,14636,607,Жизнь в Кабине
GB,2,pNgvq-WrhGw,Modern Motorcycles are TOO EXPENSIVE,2024-11-26,674039,41617,313,ThoughTaken
GB,2,Xxk6H_45QI4,Just a little love tap smiling_face_with_hearts @Racexotics,2024-11-24,398084,35837,202,Woyshnis Media
GB,2,bOB0XYUzvMk,Ещё чуть чуть и....,2024-11-20,5308638,221566,2451,Extazzy
GB,2,5y5cD4_FHRk,Racing Our $500 Ranger 500 Miles Offroad,2024-12-02,739193,37956,2220,Donut
GB,2,2B3aDBzujHU,Close Call!flushed_faceman_facepalming,2024-11-17,1303934,39400,2752,𝙃 𝙀 𝙇 𝙇 𝘾 𝘼 𝙏 𝘿 𝙐 𝙍 𝘼 𝙉 𝙂 𝙊
GB,2,tRjqRE7aG9c,I Bought The CHEAPEST Yamaha R1 In The Country,2024-12-02,76770,4351,197,44Teeth
GB,2,wWnGV-nJTvg,Happens every single time leaving a car show face_with_steam_from_nose,2024-11-21,1569537,106555,522,Golden Reyes
GB,2,Peh_RHerVfU,Operating an 80 year old tractor | تشغيل حراثة عمرها ثمانين سنة,2024-11-14,9713692,222534,2423,الهداف ALHADAF
GB,2,nEeBbEDWhTI,Do you like,2024-11-21,58144,563,22,Top Drawer Man
GB,2,dMZxUuqQDWc,What's Behind the Weird Wheel Tilt Trend?,2024-11-27,308983,16163,53,Satisfied Workers
GB,2,WGkKpQJTWPE,Куда показали-туда и поехал…,2024-11-29,1768957,33601,450,Юмор.есть
GB,2,oqygKODI3L0,World's Safest Tireface_with_open_mouth,2024-11-28,376206,3135,9,MOG Stories
GB,2,k2O80_RCaSM,cars,2024-11-23,291915,5899,536,Sammy Lucky Day Comps
GB,2,QWtmUmuyvNE,change oil on beat deluxe?,2024-11-29,2243904,22846,55,Variozy
GB,2,TZsHh18Vku8,1999 Porsche RESURRECTION || TOWER of POWER || Everything You Need To Know About The Boxster!,2024-11-29,55441,3947,426,Tasty Classics
GB,2,0OQuBwjn9R4,ВЫХЛОП НА БМВ M3,2024-12-01,753125,36267,736,Мистер Глушитель
GB,2,vU0St6nNjaE,Ultimate Gemini Build (will chop the 240Z all day long),2024-12-03,202777,14249,914,Mighty Car Mods
GB,2,ha9Np5VK8Fs,New York City Killed My Koenigsegg.,2024-12-02,508031,34786,2552,TheStradman
GB,2,0J-fcKx2l_s,"UNBELIEVABLE UK DASH CAMERAS | Lady Driver Cuts Van Driver, Stupid Overtake & Brakes, Road Rage!",2024-12-01,51364,970,286,Dashflix
GB,2,oO1OsHAK2I4,I COPPED AN SVJ ROADSTER! FIRST DRIVE !!,2024-12-01,69686,2003,394,HED 2.0
GB,2,InctfqSBxK0,Новая тачка Славы! Вы офигеете :),2024-11-28,2865573,118631,9665,ИЛЬДАР АВТО-ПОДБОР
GB,2,0F7p2AysHrY,Tires Slashed on New Truck - Possible Retaliation,2024-11-15,1595903,28781,1840,Gorilla Pro Customs
GB,2,_TcSn3G42IQ,"IVE GIVEN UP ON ONE OF MY REBUILDS, BIG UPDATE!!... TVR, RS6 ETC...",2024-11-27,151635,10509,408,Saving Salvage
GB,2,PPcZk813bdQ,ПОЛИЦИЯ vs ДРИФТЕРЫ! Реальный ФОРСАЖ в Японии!,2024-11-30,849144,82776,4677,ФОРСАЖ
GB,10,hgYhws0AHcg,Juice WRLD - Empty Out Your Pockets (Official Fortnite Video),2024-11-30,6806545,485805,42572,JuiceWRLDVEVO
GB,10,fuV4yQWdn_4,squabble up,2024-11-25,14299663,767692,45756,Kendrick Lamar
GB,10,XSULzJJ-cOs,Grime Scene Saviours (Official Video),2024-11-26,444394,21041,2393,Chiptubeofficial
GB,10,TU21pZjM4-0,Chrystal -The Days (Mazza L20 remix),2024-11-29,253754,7045,1261,Mazza_l20
GB,10,8RAd-_Qj_ac,PEELINGS (Telugu Lyrical Video) | Pushpa 2 The Rule | Allu Arjun | Rashmika Mandanna | Sukumar | DSP,2024-12-01,18811404,594967,24361,T-Series Telugu
GB,10,40ODG3OieIs,Potter Payper - Fire in the Booth pt2 United_Kingdom,2024-11-28,165457,6586,747,CharlieSloth
GB,10,jlStFS_jIEM,Loski - War Outside [Official Music Video] | @Loskiharlem,2024-11-28,346306,7096,299,Loski Official
GB,10,CDiYk07FG1Y,Band Aid - Do They Know It’s Christmas? (2024 Ultimate Mix / 40th Anniversary Video),2024-11-25,601639,12616,1895,BandAidVEVO
GB,10,U8F5G5wR1mk,Kendrick Lamar - tv off (Official Audio),2024-11-22,10983837,391650,29280,Kendrick Lamar
GB,10,qeqj5GnoFUY,Defying Gravity (From Wicked The Soundtrack),2024-11-22,4460439,66857,4257,Republic Records
GB,10,0FyMitOjzB0,Blade Brown - 16 Summers [Music Video] | GRM Daily,2024-11-28,237659,5134,194,GRM Daily
GB,10,1F3OGIFnW1k,"Stromae, Pomme - “Ma Meilleure Ennemie” (from Arcane Season 2) [Official Visualizer]",2024-11-23,12846324,389016,10459,Riot Games Music
GB,10,U2DdHZNKtNk,Potter Payper Ft Aitch - DND (Official Video),2024-11-28,139194,4145,287,Potter Payper
GB,10,6TK--iArtQM,Juice WRLD - Misfit (Official Music Video),2024-11-29,1966326,127604,8694,JuiceWRLDVEVO
GB,10,yhXTkFnAews,Empty Out Your Pockets,2024-11-30,1395744,69637,4273,Juice WRLD - Topic
GB,10,wCni9sbYJh0,Sia - Snowman (Lyrics),2024-11-29,819536,3161,89,Pizza Music
GB,10,YwUQ_5iV9pY,Kendrick Lamar - wacced out murals (Official Audio),2024-11-22,9253392,289087,20469,Kendrick Lamar
GB,10,nBCkXe3ZfoI,Ed Sheeran - Under the Tree (from “That Christmas”),2024-11-26,3177951,108512,3284,Ed Sheeran
GB,10,Yr9TnDPLL5k,Noizy - Vllazni,2024-11-30,1091383,20646,585,thisisnoizy
GB,10,Jn8KvdWagfo,ROSÉ & Bruno Mars - APT. (live from 2024 MAMA AWARDS),2024-11-22,23978100,827747,19535,ROSÉ
GB,10,HAWYOuMGkK0,V 'Winter Ahead (with PARK HYO SHIN)' Official MV,2024-11-29,8815467,1409034,126536,HYBE LABELS
GB,10,pNgeCAHJn20,Misha Miller x @AlexVelea - BAM BAM | Official Video,2024-11-22,4688776,66317,1905,Misha Miller
GB,10,3C1n5lqGdmY,KISSIK Lyrical Video | Pushpa 2 The Rule | Allu Arjun | Sukumar | Sreeleela | DSP,2024-11-24,47585880,658362,29377,T-Series Telugu
GB,10,pLdP6kUy4IQ,Sit Down Son (Official Video) Navaan Sandhu | Rxtro | Avvy | SKY Digital | New Punjabi Songs 2024,2024-11-30,1262880,52599,3107,Navaan Sandhu
GB,10,AGgfFGrN88s,Ma Meilleure Ennemie (from the series Arcane League of Legends),2024-11-23,7932610,204913,1632,Stromae - Topic
GB,10,DZ4BtMpaJaU,EKDEV LIMBU - Jhim Jhimaune Aankha [Official Music Video],2024-11-29,2607708,205316,5775,Ekdev Limbu
GB,10,XTp5jaRU3Ws,WAVY (OFFICIAL VIDEO) KARAN AUJLA | LATEST PUNJABI SONGS 2024,2024-11-15,31358713,497191,22489,Karan Aujla
GB,10,pZ1NdE69VTs,ROSÉ - number one girl (official music video),2024-11-22,41329469,1870638,113598,ROSÉ
GB,10,qWKrMxgl_ts,EMRAH x AZIS - PAK MI ZVANISH / Емрах х Азис - Пак ми звъниш | OFFICIAL 4K VIDEO 2024,2024-11-29,1186902,31857,1259,Storaro Music
GB,10,pXEGZ0V0rvw,Dani Mocanu - RUSIA Russia Official Video,2024-12-03,540385,64094,3611,Dani Mocanu copyright Oficial
GB,15,Eb4g_ofb7zk,the cat finally realized how much they loved her red_heart,2024-11-28,18445052,0,589,Brad Nolan
GB,15,bXUGyStgflg,dog love edit a dog purpose,2024-11-29,11469084,620275,1797,Crying Raccoon
GB,15,3ijSagPdGDI,How Bear Traps Work thinking_face,2024-12-01,8518922,730014,2895,Zack D. Films
GB,15,wdFzB7B6mvM,He Learns to Open the Recliner but Gets Pranked! face_with_tears_of_joy(Credit @rubythelabrador subscribe to him),2024-11-28,11139128,625323,434,Nox Jackson
GB,15,0lz1Aw_XRP4,The reality of accidents with dogs smiling_face_with_tear,2024-11-28,6045381,288911,540,Mocha Pom
GB,15,Ny-WoYRSQ1o,His dream came true and he can't get in smiling_face_with_heart-eyes smiling_face_with_heart-eyes,2024-11-24,12771875,412134,2042,Marcos Sanchez
GB,15,qOFOHqtmngU,Making My Puppy A Yellow Dress smiling_face_with_smiling_eyes,2024-12-02,3793148,270095,2699,Yellow Dress Girl
GB,15,m2prO7iey7Y,At this point he gotta pay rent,2024-11-26,4286176,252065,4396,Meech 2x
GB,15,J6zQPU_C5IM,Wildlife,2024-11-27,5738012,144088,3039,Julia TK
GB,15,zVt_qplzPmI,The Ending Is Crazy!rolling_on_the_floor_laughing,2024-12-01,2532385,242011,2127,Jason Reed
GB,15,TIqpVo6fVP8,Funny cats and dogs compilation,2024-11-26,2518642,122386,223,PositiveWorld
GB,15,yXri_y2Lod4,8 Unbelievable Animal Secrets You’ll Learn Today!,2024-11-28,5129394,162268,1068,My Amazing World
GB,15,CKL3ipf2B34,Your cat vs My Cat,2024-11-24,9302425,695100,4933,Your CAT grinning_cat
GB,15,RM5ZdlJk4H0,Which animal’s could you beat?,2024-11-23,12590434,584963,903,Dude Deals
GB,15,yhKqOCV2a8s,"Sometimes things go horribly wrong, Rhino Attacks Safari Jeep full of tourists. Watch till the end.",2024-11-23,40173359,396787,4206,wild it woo
GB,15,3iKQ1XDZEqc,Giant Hornet Attack! Honeybee Counterstrike,2024-11-26,3523910,130989,3347,Japanese natural beekeeping
GB,15,xzX0FpQdoAw,eyesThere are Monsters in Mexico…,2024-11-23,15089275,380123,1615,Wide Open Outfitters
GB,15,tOy-VVnAnII,Cat Destroys Train,2024-11-21,11216857,761210,1527,yip.animals
GB,15,JfiEc7iOT0s,VET inject HEDGEHOG With HER MOUTH!,2024-11-28,4383220,225334,806,Animal Rescue Comedy!
GB,15,2gneUzG6XqU,CUSTOMER IS MAD NAIL TECH IS WORKING WITH A DOG,2024-11-29,1424107,45266,603,Mulanana
GB,15,jN9ewT2Qmzg,They had a scorpion fight in the armyflushed_facesaluting_face,2024-11-25,4800630,429784,1423,Soldier House
GB,15,Cu2hfZwC9rA,"If I got here in 1949,and it’s 2023,what does that make me?face_with_tears_of_joyA reptile movie:",2024-11-25,7512917,540124,2496,Nancy Clips
GB,15,NHFhzjBRi4c,Разборки четвероногихgrinning_face_with_smiling_eyes  _ruby.the.labrador_,2024-11-29,6858044,321476,495,FilmBytes
GB,15,kYUqC3qPfSY,Luna forgave without retaliating pleading_face,2024-11-29,2798005,0,9391,MSR USA
GB,15,Myin0zFNPQk,A German Shepherd's First Day at Daycare,2024-11-24,6868729,373989,2901,Postsflare
GB,15,VgKi3koT26M,Grandpa Wins Argument With Dog Over Couch Seat,2024-11-28,2588916,170727,3829,D Pet Master
GB,15,2Hcxu4SuLYY,Wildlife monkey in Mohanokor troop,2024-11-28,16359508,305026,3625,Monkey Living
GB,15,I7cbG-tmjZg,The Giant Sea Monster Caught by Fishermen,2024-11-29,13823612,117766,0,Phongorr
GB,15,9IJZy5ChAMc,art school is a fever dream,2024-11-27,2079611,290027,676,Morgan Schmitz
GB,15,0klm_EKgkHY,The way she doesnt give two craps about the kids lol grinning_squinting_face,2024-11-20,6263064,250963,2267,Just a girl & her animals
GB,15,FQ6wTyqPZwQ,My cat has selective hearing,2024-12-01,1346688,79009,381,링고다냥
GB,15,a4dRGd9ljZM,The sad story of a cutie pie baby penguin who survived with a piece of container around his neck,2024-11-20,14335182,688866,11957,Wonderful Pocket
GB,15,MczU9mCcfdA,Searching My Alligator’s Nest For Eggs!!!face_screaming_in_fearcrocodileegg,2024-11-21,9621628,412726,393,Corbin Maxey
GB,15,nhXIjGRdJY4,sleepy kitteh movie_camera: meeadzz (TT),2024-11-27,4117320,226098,1153,Dusty Douglas
GB,15,PvdLRhTfZ2g,shorts animals cuteanimals pets,2024-11-19,7719807,431396,1346,Nekola Callery
GB,15,V6KZHBG35bU,Probably because the weather is too hot,2024-11-25,2643309,69613,968,WOOD WOOD
GB,15,zT0hHvONSfE,у этого медведя несварение face_screaming_in_fearbear,2024-11-29,9014075,219156,1321,Мир милых животных hedgehog
GB,15,y6-6jMENi18,Primary school teachers after an incident,2024-11-24,985904,47967,262,Monica Geldart
GB,15,JVkVDcazPXA,These dogs will never steal again!face_screaming_in_feardog_face,2024-11-26,3325596,379806,10716,Gwen Shorts
GB,15,g3M4P9WQUCU,Animals' Warning Signals to Humans,2024-12-01,7993397,160764,1125,Happy Explorer
GB,15,WkKueXPLyCA,He Had To Race His Dogs face_with_tears_of_joy,2024-11-30,1876715,139423,310,Omar Raja - ESPN
